tool_id,tool_name,primary_category,license_type,description,website_url,tags,created_at,updated_at
60,Workday Human Capital Management,General,Commercial,"Workday HCM is a comprehensive cloud-based system for workforce planning, analysis, and execution. It integrates various aspects of HR including recruiting, talent management, payroll, and benefits. Its AI capabilities help in predicting hiring needs, analyzing workforce skills, and planning succession, supporting effective talent management strategies.",https://www.workday.com/en-us/products/human-capital-management/human-resource-management.html,{},2025-05-23 02:42:59.31682,2025-05-23 02:42:59.31682
61,iCIMS Talent Cloud,General,Commercial,"iCIMS Talent Cloud is a recruitment platform that enables organizations to attract, engage, hire, and advance the right talent. It uses AI to automate and enhance various recruitment processes, such as candidate screening, communications, and engagement, making the recruitment process more efficient and effective.",https://www.icims.com,{},2025-05-23 02:42:59.319234,2025-05-23 02:42:59.319234
62,Smartsheet,General,Commercial,"Smartsheet is a platform for work management and automation that supports strategic planning and execution by allowing users to manage projects and processes at scale. It provides capabilities for setting objectives, planning workflows, and tracking progress through customizable dashboards and automated reporting. Smartsheet's flexible platform can adapt to a wide range of business needs, facilitating agile responses to changing market dynamics.",https://smartsheet.com,{},2025-05-23 02:42:59.343259,2025-05-23 02:42:59.343259
63,Tact.ai,General,Commercial,"Tact.ai is an AI-driven sales assistant that uses natural language understanding and processing to help sales teams engage effectively with clients. It assists in managing communications and follow-ups, ensuring a personalized and trust-building interaction with clients.",https://tact.ai,{},2025-05-23 02:42:59.370054,2025-05-23 02:42:59.370054
72,SparkToro,General,Freemium,"SparkToro applies AI to discover the websites, social media accounts, and publications that a target audience reads and follows. This tool aids in understanding where to focus marketing efforts for effective go-to-market strategies.",https://sparktoro.com,{},2025-05-23 02:42:59.567033,2025-05-23 02:42:59.567033
75,PhoneBurner,General,Commercial,"PhoneBurner is a power dialer that increases the efficiency of cold calling by automating repetitive tasks such as dialing, leaving voicemails, and sending follow-up emails. It allows sales teams to focus more on conversation rather than manual processes.",https://www.phoneburner.com,{},2025-05-23 02:42:59.781619,2025-05-23 02:42:59.781619
76,Kixie,General,Commercial,"Kixie is an intelligent phone system that offers an integrated power dialer. It helps in automating the cold calling process with features like local presence dialing, one-click voicemail drop, and real-time call coaching to improve the effectiveness of sales calls.",https://www.kixie.com,{},2025-05-23 02:42:59.783892,2025-05-23 02:42:59.783892
78,LeadSquared,General,Commercial,"LeadSquared uses automation and AI to streamline lead capture, track engagement, and score leads based on predefined criteria. It helps in identifying the most promising leads by analyzing their activities and engagement across various channels.",https://www.leadsquared.com/,{},2025-05-23 02:42:59.825372,2025-05-23 02:42:59.825372
79,Pega Customer Decision Hub,General,Commercial,"This tool uses AI and predictive analytics to understand customer behavior and needs. It helps sales teams by providing insights and suggesting the next best action to take with each customer, effectively communicating the value of products or services based on individual customer data.",https://www.pega.com/products/customer-decision-hub,{},2025-05-23 02:42:59.861275,2025-05-23 02:42:59.861275
80,Dialpad Contact Center,General,Commercial,"Dialpad Contact Center leverages AI to streamline outbound calling processes. It includes voice intelligence features that transcribe calls in real-time and provide live coaching tips to agents, enhancing the efficiency of high-volume call activities.",https://www.dialpad.com,{},2025-05-23 02:42:59.938136,2025-05-23 02:42:59.938136
81,Talkdesk CX Cloud,General,Commercial,Talkdesk CX Cloud offers an AI-infused contact center solution that supports high-volume outbound calling. It features smart dialers that automate the dialing process and analytics tools to monitor and optimize agent performance and call scheduling.,https://www.talkdesk.com,{},2025-05-23 02:42:59.940212,2025-05-23 02:42:59.940212
82,NetBase Quid,General,Commercial,"NetBase Quid is a market intelligence platform that uses natural language processing and machine learning to analyze social media, news, and other data sources. It provides insights into market trends, competitive intelligence, and consumer behavior, helping businesses to strategize and react quickly to market changes.",https://www.netbasequid.com,{},2025-05-23 02:42:59.983701,2025-05-23 02:42:59.983701
83,Aventri,General,Commercial,Aventri's Smart Tag technology uses AI to facilitate networking by allowing attendees to exchange information digitally and track interactions. The platform also uses AI to provide insights on attendee behavior and preferences to improve event engagement.,https://www.aventri.com,{},2025-05-23 02:42:59.988855,2025-05-23 02:42:59.988855
84,Process Street,General,Freemium,"Process Street provides a platform for businesses to create and manage their workflows, processes, and checklists. It enhances organizational process transparency by allowing teams to document every step of a process, which can then be shared and accessed by all team members. This ensures that everyone is aware of the procedures and their roles, thereby increasing accountability and clarity.",https://www.process.st,{},2025-05-23 02:42:59.998321,2025-05-23 02:42:59.998321
92,IBM Watson Requirements Quality Assistant,General,Commercial,"IBM Watson Requirements Quality Assistant uses AI to help improve the quality of requirements documentation by providing insights and suggestions. It can analyze natural language requirements and provide feedback on clarity, completeness, and consistency, which can then be translated into technical specifications for developers.",https://www.ibm.com/products/requirements-quality-assistant,{},2025-05-23 02:43:00.053425,2025-05-23 02:43:00.053425
93,ReqSuite RM,General,Commercial,"ReqSuite RM is a requirements management tool that uses AI to assist in documenting and managing requirements. It provides functionalities to automatically suggest improvements and ensure consistency and completeness in requirements, which can be directly translated into technical specifications for IT solutions.",https://www.osseno.com/en/reqsuite-rm/,{},2025-05-23 02:43:00.055852,2025-05-23 02:43:00.055852
94,Jama Connect,General,Commercial,"Jama Connect is a product development platform that facilitates the creation of detailed, comprehensive requirements documents. It integrates AI-powered features to assist in analyzing and validating the requirements against industry standards, ensuring they can be effectively translated into technical specifications.",https://www.jamasoftware.com/product/,{},2025-05-23 02:43:00.057436,2025-05-23 02:43:00.057436
95,Visure Requirements,General,Commercial,"Visure Requirements is an ALM tool that leverages AI to streamline the requirements documentation process. It provides features for requirements elicitation, analysis, and validation, helping translate business needs into technical specifications through automated traceability and impact analysis.",https://www.visuresolutions.com/,{},2025-05-23 02:43:00.058724,2025-05-23 02:43:00.058724
96,Testim,General,Commercial,"Testim leverages machine learning for the authoring, execution, and maintenance of automated test cases. It supports developers in unit testing by simplifying the creation of test scenarios and integrates with CI/CD pipelines for continuous testing. Additionally, it enables collaboration with business partners for user acceptance testing through easy-to-use interfaces and detailed test reports.",https://www.testim.io/,{},2025-05-23 02:43:00.059804,2025-05-23 02:43:00.059804
97,Applitools,General,Freemium,Applitools provides an AI-powered visual testing and monitoring platform that helps developers ensure the visual accuracy of their applications across different devices and browsers. It supports automated unit testing by integrating with existing test frameworks and facilitates user acceptance testing by allowing non-technical stakeholders to easily verify visual aspects of UIs.,https://applitools.com/,{},2025-05-23 02:43:00.061005,2025-05-23 02:43:00.061005
98,Functionize,General,Commercial,"Functionize utilizes AI to enhance test creation, execution, and analysis, facilitating both unit and acceptance testing. It provides tools for developers to automate complex tests easily and integrates with tools like JIRA to enable seamless communication with business partners during user acceptance testing phases.",https://www.functionize.com/,{},2025-05-23 02:43:00.066463,2025-05-23 02:43:00.066463
106,Microsoft System Center,General,Commercial,"Microsoft System Center provides a comprehensive management solution for computer systems. It offers capabilities for configuration management, orchestration, virtual machine management, and data protection. This tool is particularly useful for managing large-scale IT environments that include both Microsoft and non-Microsoft technology components.",https://www.microsoft.com/en-us/cloud-platform/system-center,{},2025-05-23 02:43:00.095056,2025-05-23 02:43:00.095056
107,Gartner,General,Commercial,"Gartner provides detailed, data-driven research and analysis on IT technologies, offering insights and recommendations through its various research tools and reports. This helps organizations evaluate new IT technologies and make informed decisions.",https://www.gartner.com,{},2025-05-23 02:43:00.096772,2025-05-23 02:43:00.096772
108,Forrester,General,Commercial,Forrester offers a range of research and consulting services that help organizations assess new technologies. Their market research reports and technology adoption roadmaps are crucial for companies looking to enhance their IT infrastructure.,https://www.forrester.com,{},2025-05-23 02:43:00.097901,2025-05-23 02:43:00.097901
109,IDC,General,Commercial,IDC provides comprehensive research and advisory services that cover a wide range of IT technologies. Their market analysis and forecasts are valuable for organizations looking to invest in new technologies.,https://www.idc.com,{},2025-05-23 02:43:00.098946,2025-05-23 02:43:00.098946
110,Splunk IT Service Intelligence (ITSI),General,Commercial,"Splunk ITSI is an AI-powered monitoring and analytics tool designed to optimize IT operations. It uses machine learning to predict and prevent problems across complex IT environments, enhancing system reliability and performance. The tool provides actionable insights and visualizations for IT systems, networks, and storage solutions, making it ideal for critical utility environments.",https://www.splunk.com/en_us/software/it-service-intelligence.html,{},2025-05-23 02:43:00.10332,2025-05-23 02:43:00.10332
111,IBM Watson AIOps,General,Commercial,"IBM Watson AIOps uses artificial intelligence to automate IT operations. It helps IT teams predict, automate, and resolve IT issues by analyzing large volumes of operational data across various IT environments. The tool integrates with existing IT management solutions to provide a comprehensive view of IT health, particularly useful in complex and critical infrastructures.",https://www.ibm.com/products/watson-aiops,{},2025-05-23 02:43:00.104951,2025-05-23 02:43:00.104951
114,BMC Helix,General,Commercial,"BMC Helix offers a suite of AI-driven IT operations management (ITOM) solutions that automate and optimize IT infrastructure management. It covers monitoring, event management, and automation across servers, storage, network, and cloud services, integrating AI capabilities to predict and prevent IT issues.",https://www.bmc.com/it-solutions/helix.html,{},2025-05-23 02:43:00.11465,2025-05-23 02:43:00.11465
116,Datadog,General,Commercial,"Datadog is a monitoring and security platform for cloud applications. It integrates and automates infrastructure monitoring, application performance monitoring, and log management to provide real-time observability and data-driven insights across the entire IT stack.",https://www.datadoghq.com/,{},2025-05-23 02:43:00.1198,2025-05-23 02:43:00.1198
117,ScienceLogic SL1,General,Commercial,"ScienceLogic SL1 is an AI-powered IT operations platform that automates the monitoring, visualization, and control of IT infrastructure environments. It supports a wide range of devices and applications, providing dynamic topology mapping and actionable insights to manage complex IT landscapes efficiently.",https://sciencelogic.com/product,{},2025-05-23 02:43:00.121671,2025-05-23 02:43:00.121671
118,IBM Security Guardium,General,Commercial,"IBM Security Guardium is designed to ensure data protection and compliance by automating the discovery, classification, and real-time monitoring of data and data activity. It provides a comprehensive data security platform that supports a wide range of IT governance and security policy management needs, including vulnerability assessments, data masking, and encryption.",https://www.ibm.com/security/data-security/guardium,{},2025-05-23 02:43:00.122836,2025-05-23 02:43:00.122836
119,ManageEngine ADManager Plus,General,Commercial,"ManageEngine ADManager Plus is a unified management and security solution that simplifies various aspects of IT governance including Active Directory management and reporting. The tool automates a range of administrative tasks such as user provisioning/de-provisioning, thereby enforcing IT policies and compliance with security standards.",https://www.manageengine.com/products/ad-manager/,{},2025-05-23 02:43:00.124032,2025-05-23 02:43:00.124032
120,Varonis Data Security Platform,General,Commercial,"The Varonis Data Security Platform specializes in data protection and threat detection by analyzing data, account activity, and user behavior. It ensures that only the right people have access to the right data at all times, monitors use, and alerts on abuse. This helps in implementing IT governance and security policies effectively.",https://www.varonis.com,{},2025-05-23 02:43:00.12507,2025-05-23 02:43:00.12507
121,Symantec Control Compliance Suite,General,Commercial,"The Symantec Control Compliance Suite is a comprehensive solution that delivers policy management and compliance capabilities across IT infrastructure. It automates security assessments and provides risk management and compliance reporting, which are essential for effective IT governance.",https://www.broadcom.com/products/cyber-security/endpoint/management/compliance-suite,{},2025-05-23 02:43:00.126147,2025-05-23 02:43:00.126147
123,SAP Ariba,General,Commercial,"SAP Ariba uses machine learning algorithms to enhance procurement processes by providing insights into spending patterns and supplier performance, helping organizations make better decisions about which technologies to procure based on historical data and predictive analytics.",https://www.ariba.com,{},2025-05-23 02:43:00.13217,2025-05-23 02:43:00.13217
124,Coupa Software,General,Commercial,"Coupa's AI-powered platform provides comprehensive spend analysis and procurement solutions that automate the procurement process, from sourcing to payment. It helps in selecting the best vendors and technologies based on performance metrics and cost-effectiveness.",https://www.coupa.com,{},2025-05-23 02:43:00.13433,2025-05-23 02:43:00.13433
125,GEP SMART,General,Commercial,"GEP SMART utilizes artificial intelligence to automate and streamline end-to-end procurement processes. It features advanced analytics for better decision-making in IT procurement, helping organizations choose the right technologies by analyzing market trends and supplier capabilities.",https://www.gep.com/software/gep-smart,{},2025-05-23 02:43:00.135881,2025-05-23 02:43:00.135881
130,Veeam Backup & Replication,General,Commercial,"Veeam Backup & Replication offers comprehensive backup and disaster recovery solutions. It includes features for automated disaster recovery testing, ensuring that recovery procedures are both effective and up-to-date. The tool also helps in documenting recovery processes and generating reports to improve compliance and readiness.",https://www.veeam.com,{},2025-05-23 02:43:00.156364,2025-05-23 02:43:00.156364
131,Site Recovery Manager,General,Commercial,"VMware's Site Recovery Manager is a business continuity and disaster recovery solution that automates the process of transferring workloads to a recovery site. It supports policy-driven automation and allows for non-disruptive testing of disaster recovery plans, ensuring minimal downtime and maximum compliance to set recovery point objectives.",https://www.vmware.com/products/site-recovery-manager.html,{},2025-05-23 02:43:00.158329,2025-05-23 02:43:00.158329
132,Azure Site Recovery,General,Commercial,"Azure Site Recovery provides disaster recovery as a service (DRaaS) by orchestrating replication, failover, and recovery of virtual machines and physical servers. It allows for customizable recovery plans, automated recovery testing, and integration with Azure Monitor for real-time health monitoring of protected instances.",https://azure.microsoft.com/en-us/services/site-recovery/,{},2025-05-23 02:43:00.159466,2025-05-23 02:43:00.159466
133,Kira,General,Commercial,"Kira is an advanced machine learning software that helps organizations extract relevant information from contracts and other documents. It automates the process of identifying, analyzing, and extracting clauses that are crucial for compliance with company policies and legal standards.",https://kirasystems.com,{},2025-05-23 02:43:00.175721,2025-05-23 02:43:00.175721
134,Icertis Contract Management,General,Commercial,"Icertis Contract Management uses AI to ensure that contracts are compliant with both internal corporate policies and external regulations. It features tools for contract creation, workflow automation, and compliance tracking, making it easier to manage and enforce compliance across all sales contracts.",https://www.icertis.com,{},2025-05-23 02:43:00.177784,2025-05-23 02:43:00.177784
136,Onit Contract Lifecycle Management,General,Commercial,"Onit's Contract Lifecycle Management tool uses AI to automate and optimize the contract creation and management process. It includes compliance checks to ensure all contracts meet company standards and legal obligations, reducing risks and improving efficiency.",https://www.onit.com,{},2025-05-23 02:43:00.182641,2025-05-23 02:43:00.182641
138,Expensify,General,Freemium,"Expensify automates expense reporting and tracking, from receipt scanning to reimbursement. Its compliance features ensure that all transactions adhere to company policies and budget limits, facilitating effective budget management and financial compliance.",https://www.expensify.com,{},2025-05-23 02:43:00.187951,2025-05-23 02:43:00.187951
139,Prophix,General,Commercial,"Prophix offers a software solution for budgeting, planning, forecasting, reporting, and consolidations. It helps ensure compliance with financial policies and budget constraints by automating financial processes and providing detailed analytics and reporting capabilities.",https://www.prophix.com,{},2025-05-23 02:43:00.190593,2025-05-23 02:43:00.190593
140,Pensa Systems,General,Commercial,"Pensa Systems provides an AI-driven visual perception system that automates the monitoring of retail shelf conditions. This tool uses advanced computer vision and machine learning to analyze store shelves, ensuring that visual merchandising guidelines are followed accurately across multiple locations.",https://www.pensasystems.com,{},2025-05-23 02:43:00.19168,2025-05-23 02:43:00.19168
141,Trax Retail,General,Commercial,"Trax Retail offers computer vision solutions and analytics for retail execution and shelf monitoring. The tool captures shelf images and uses AI to analyze and report on product placement, stock levels, and compliance with visual merchandising standards, helping brands maintain consistency and optimize display effectiveness.",https://www.traxretail.com,{},2025-05-23 02:43:00.192836,2025-05-23 02:43:00.192836
142,Focal Systems,General,Commercial,Focal Systems provides a shelf camera solution that uses deep learning to monitor and analyze shelf conditions in real-time. This tool helps retailers ensure that merchandising strategies are properly executed by automatically detecting deviations from planned layouts and promotional compliance.,https://www.focal.systems,{},2025-05-23 02:43:00.195075,2025-05-23 02:43:00.195075
143,ShelfWatch,General,Commercial,"ShelfWatch is powered by Simbe Robotics and utilizes autonomous robots equipped with computer vision technology to scan and analyze retail environments. It ensures compliance with visual merchandising guidelines by providing detailed reports on product placement, promotional execution, and overall shelf health.",https://www.simberobotics.com/shelfwatch,{},2025-05-23 02:43:00.196429,2025-05-23 02:43:00.196429
144,IBM Sterling Order Management,General,Commercial,"IBM Sterling Order Management orchestrates complex order fulfillment processes across multiple channels and partners, ensuring accurate and timely delivery. It uses AI to optimize inventory allocation and fulfillment processes, enhancing customer satisfaction by ensuring orders are fulfilled efficiently and accurately.",https://www.ibm.com/products/order-management,{},2025-05-23 02:43:00.197549,2025-05-23 02:43:00.197549
145,SAP Integrated Business Planning for Supply Chain,General,Commercial,"SAP's Integrated Business Planning tool leverages AI and machine learning to improve order fulfillment accuracy and timing. It integrates real-time data from across the supply chain, enabling predictive analytics for demand planning and optimized inventory management, which are crucial for timely order fulfillment.",https://www.sap.com/products/integrated-business-planning.html,{},2025-05-23 02:43:00.198642,2025-05-23 02:43:00.198642
147,Oracle NetSuite Order Management,General,Commercial,"Oracle NetSuite Order Management system automates and streamlines order processing by integrating sales, finance, and fulfillment teams. It uses AI to manage inventory and order routing, ensuring that customer orders are fulfilled efficiently and accurately, which enhances customer satisfaction.",https://www.netsuite.com/portal/products/erp/order-management.shtml,{},2025-05-23 02:43:00.203974,2025-05-23 02:43:00.203974
151,Cornerstone Learning,General,Commercial,"Cornerstone Learning delivers an AI-driven development experience that personalizes learning and development paths based on employee roles, career aspirations, and organizational needs. This ensures rapid role adaptation as the company grows and changes.",https://www.cornerstoneondemand.com/learning/,{},2025-05-23 02:43:00.218643,2025-05-23 02:43:00.218643
152,Microsoft Azure Text Analytics,General,Commercial,"Microsoft Azure Text Analytics offers key phrase extraction, sentiment analysis, and entity recognition capabilities. These features enable the tool to analyze extensive documents like customer agreements and service plans to identify key terms and conditions, helping to propose optimized, cost-saving alternatives based on the analysis.",https://azure.microsoft.com/en-us/services/cognitive-services/text-analytics/,{},2025-05-23 02:43:00.228515,2025-05-23 02:43:00.228515
153,Amazon Comprehend,General,Commercial,"Amazon Comprehend uses natural language processing to discover insights from text. The service can analyze customer agreements and service plans, identifying terms, entities, and the context of discussions, which can be used to recommend more cost-effective service options tailored to the customer's needs.",https://aws.amazon.com/comprehend/,{},2025-05-23 02:43:00.230467,2025-05-23 02:43:00.230467
154,Deputy,General,Commercial,"Deputy is a workforce management tool that helps businesses schedule staff based on varying job requirements and timeframes. It uses AI to forecast staffing needs and optimize schedules for consistency and adherence to working hours, enhancing service delivery.",https://www.deputy.com,{},2025-05-23 02:43:00.231641,2025-05-23 02:43:00.231641
155,When I Work,General,Freemium,"This tool offers employee scheduling capabilities that ensure staff are working the hours required by their specific roles. It includes features for shift planning and real-time communication, which help maintain consistent service delivery according to job demands.",https://wheniwork.com,{},2025-05-23 02:43:00.232814,2025-05-23 02:43:00.232814
156,Humanity,General,Commercial,"Humanity is a cloud-based scheduling tool that leverages AI to create conflict-free schedules, ensuring optimal staffing levels that adhere to predetermined working hours tailored to specific job requirements. This helps in maintaining reliability in service delivery.",https://www.humanity.com,{},2025-05-23 02:43:00.233799,2025-05-23 02:43:00.233799
157,Shiftboard,General,Commercial,"Shiftboard helps organizations automate the scheduling process, using AI to ensure that employees are working according to the specific requirements of their jobs. It supports complex, location-specific scheduling needs, crucial for consistent service delivery.",https://www.shiftboard.com,{},2025-05-23 02:43:00.234892,2025-05-23 02:43:00.234892
