tool_id,tool_name,primary_category,license_type,description,website_url,tags,created_at,updated_at
204,Tableau CRM,CRM Analytics,Commercial,"Tableau CRM (formerly Einstein Analytics) integrates AI to provide advanced analytics and visualizations specifically for CRM data, including sales performance. It offers AI-driven insights and recommendations to optimize sales processes and improve performance metrics.",https://www.tableau.com/products/crm,"{AI,CRM,""Sales Analytics"",""Performance Insights""}",2025-04-27 16:11:27.022945,2025-04-27 16:11:27.022945
205,Pipedrive Insights,CRM,Commercial,Pipedrive Insights is a feature within the Pipedrive CRM that utilizes AI to track sales performance and generate detailed reports and dashboards. It helps sales teams visualize their sales pipeline and performance metrics to enhance decision-making.,https://www.pipedrive.com/en/features/insights,"{""Sales Tracking"",AI,CRM,""Data Visualization""}",2025-04-27 16:11:27.023261,2025-04-27 16:11:27.023261
208,Google Cloud AutoML Natural Language,Natural Language Processing,Commercial,"Google Cloud AutoML Natural Language uses machine learning to build models capable of analyzing and understanding product information from various data sources such as descriptions, reviews, and support documents. It helps in developing a deep understanding of product features and benefits, which can be used to tailor interactions and solutions for customer needs.",https://cloud.google.com/natural-language/automl/docs,"{NLP,""Machine Learning"",AutoML,""Product Knowledge""}",2025-04-27 16:11:27.02435,2025-04-27 16:11:27.02435
212,Wrike,Project Management,Freemium,"Wrike is a versatile project management tool that incorporates AI to help users manage projects from initiation to completion. Its AI features include predictive analytics, which forecasts project timelines and identifies potential bottlenecks, empowering users to proactively manage tasks and take initiative.",https://www.wrike.com,"{""predictive analytics"",""project management"",AI,""task automation""}",2025-04-27 16:11:27.025648,2025-04-27 16:11:27.025648
214,HubSpot Marketing Hub,Marketing Automation,Freemium,"HubSpot Marketing Hub uses AI and automation to help marketing teams attract the right visitors, convert more leads, and demonstrate ROI. Its integration with HubSpot CRM and Sales Hub allows for seamless collaboration between sales and marketing teams, ensuring alignment in strategies and communication, which is crucial for enhancing the sales pipeline and driving business growth.",https://www.hubspot.com/products/marketing,"{""marketing automation"",""sales alignment"",""lead management"",""ROI tracking"",CRM}",2025-04-27 16:11:27.02633,2025-04-27 16:11:27.02633
216,Microsoft Dynamics 365 for Sales,CRM Software,Commercial,"Microsoft Dynamics 365 for Sales leverages AI to enable smarter selling with contextual AI-driven insights. It facilitates collaboration between sales and marketing teams by integrating with Microsoft's suite of tools including Teams and LinkedIn, which helps in strategizing and executing marketing campaigns that directly impact the sales pipeline.",https://dynamics.microsoft.com/en-us/sales/overview/,"{CRM,""AI insights"",""Microsoft integration"",""strategic sales"",""marketing collaboration""}",2025-04-27 16:11:27.027003,2025-04-27 16:11:27.027003
192,Intercom,Customer Communication,Commercial,"Intercom provides a customer communication platform with a strong focus on automation and AI. It uses chatbots and personalized messaging services to educate and engage customers about company services, thereby supporting sales and customer service efforts.",https://www.intercom.com,"{""customer communication"",chatbots,""personalized messaging"",""customer engagement""}",2025-04-27 16:11:27.019019,2025-04-27 16:11:27.0279
219,Pendo,Product Management,Commercial,"Pendo is a product experience platform that uses data-driven insights to help companies educate users about technical products. It features in-app messaging and guides that can be tailored to the user's role and technical expertise, making it easier to communicate complex product functionalities.",https://www.pendo.io,"{""user onboarding"",""product experience"",""data analytics"",""technical education""}",2025-04-27 16:11:27.02821,2025-04-27 16:11:27.02821
220,WalkMe,Digital Adoption,Commercial,WalkMe's digital adoption platform uses AI to provide step-by-step guidance tailored to the user's needs and technical level. It helps businesses communicate the value and functionality of technical products through interactive on-screen walkthroughs.,https://www.walkme.com,"{""user guidance"",""interactive walkthroughs"",""product adoption"",""technical communication""}",2025-04-27 16:11:27.028506,2025-04-27 16:11:27.028506
226,EdApp,E-learning,Freemium,"EdApp is a mobile-first microlearning platform that incorporates AI to deliver personalized learning experiences tailored to individual sales representatives. It includes features such as spaced repetition and smart lessons that adapt based on the learner's performance, effectively helping sales teams master product knowledge.",https://www.edapp.com,"{""AI learning"",microlearning,""personalized training"",""sales training""}",2025-04-27 16:11:27.03049,2025-04-27 16:11:27.03049
227,Docebo,E-learning,Commercial,"Docebo is an AI-powered learning platform that offers a suite of tools designed to enhance the training process. It uses artificial intelligence to curate personalized content for learners, optimizing the learning paths according to the needs of sales representatives to become product experts.",https://www.docebo.com,"{""AI learning platform"",""content curation"",""adaptive learning"",""sales enablement""}",2025-04-27 16:11:27.030794,2025-04-27 16:11:27.030794
236,Google Cloud Dialogflow,Conversational AI,Freemium,"Dialogflow is a Google Cloud tool for building conversational interfaces for websites, mobile applications, and IoT devices. It can be integrated with a company's product database to train on specific product information, allowing it to conduct informed and accurate discussions about the product's features and benefits with potential clients.",https://cloud.google.com/dialogflow,"{NLP,chatbot,""Google Cloud"",AI}",2025-04-27 16:11:27.034073,2025-04-27 16:11:27.034073
241,Coursera for Business,E-learning,Commercial,"Coursera for Business offers a platform where employees can access courses specifically tailored to learning about various industries and products, as well as courses on leadership and career development. This tool helps organizations train their employees to gain a deeper understanding of their products and prepare for career advancements.",https://www.coursera.org/business,"{e-learning,""career development"",""product knowledge"",""online courses""}",2025-04-27 16:11:27.035665,2025-04-27 16:11:27.035665
242,LinkedIn Learning,E-learning,Commercial,"LinkedIn Learning provides a wide range of courses that cover product management, market applications, and career development skills. It's integrated within the LinkedIn platform, making it easy for professionals to learn in a context that is directly connected to their career profiles and networks.",https://www.linkedin.com/learning/,"{""professional development"",""product knowledge"",""career skills"",""online learning""}",2025-04-27 16:11:27.0361,2025-04-27 16:11:27.0361
243,Pluralsight Skills,E-learning,Commercial,Pluralsight Skills offers tech-centric content but also includes a variety of courses on product management and market strategies. It's particularly useful for those in tech roles looking to understand the broader market applications of their products and advance their careers within tech-focused companies.,https://www.pluralsight.com/,"{""technology education"",""product management"",""career advancement"",""skills development""}",2025-04-27 16:11:27.036438,2025-04-27 16:11:27.036438
244,Udemy for Business,E-learning,Commercial,Udemy for Business provides a platform with courses on a wide range of topics including product knowledge and career development. Companies can subscribe to allow their employees access to tailored learning paths that help them understand their products better and prepare for future roles.,https://business.udemy.com/,"{""corporate training"",""product education"",""career growth"",""online courses""}",2025-04-27 16:11:27.036772,2025-04-27 16:11:27.036772
249,Clerk.io,E-commerce Personalization,Commercial,"Clerk.io uses AI to dynamically present products based on customer behavior and preferences. It integrates with e-commerce platforms to personalize product recommendations and presentations, enhancing customer engagement and sales.",https://www.clerk.io,"{AI,E-commerce,Personalization,""Product Recommendation""}",2025-04-27 16:11:27.051665,2025-04-27 16:11:27.051665
250,Algolia Recommend,Search and Discovery,Commercial,Algolia Recommend is an AI-driven tool that provides personalized product recommendations. It uses machine learning algorithms to analyze user interactions and preferences to tailor product presentations on e-commerce sites.,https://www.algolia.com/products/recommend/,"{AI,""Search Engine"",Personalization,""Machine Learning""}",2025-04-27 16:11:27.05219,2025-04-27 16:11:27.05219
251,RichRelevance,Retail Personalization,Commercial,"RichRelevance offers advanced personalization technologies for retail, utilizing AI to tailor product presentations based on real-time user data and behavior. This enhances the shopping experience by presenting the most relevant products to each customer.",https://www.richrelevance.com,"{AI,Retail,""Customer Experience"",Personalization}",2025-04-27 16:11:27.055821,2025-04-27 16:11:27.055821
252,Dynamic Yield,Marketing Personalization,Commercial,"Dynamic Yield employs AI to optimize and personalize product presentations across web, mobile, and email. It analyzes user behavior and preferences to dynamically adjust content and product displays, improving engagement and conversion rates.",https://www.dynamicyield.com,"{AI,Marketing,Personalization,Analytics}",2025-04-27 16:11:27.05821,2025-04-27 16:11:27.05821
253,Eventbrite Boost,Event Management,Commercial,"Eventbrite Boost is an AI-powered marketing platform specifically designed for event promotion and management. It uses machine learning algorithms to optimize advertising across social platforms, predict attendee engagement, and provide insights on how to improve event reach and effectiveness.",https://www.eventbrite.com/l/boost/,"{""AI Marketing"",""Event Promotion"",""Attendee Engagement"",""Social Media Advertising""}",2025-04-27 16:11:27.065957,2025-04-27 16:11:27.065957
256,Splash,Event Management,Commercial,"Splash uses AI to help event organizers design, market, and efficiently manage events. Its AI features include automated marketing workflows and data-driven insights to maximize event exposure and attendee engagement.",https://www.splashthat.com,"{""Event Design"",""AI Marketing"",""Data Insights"",""Workflow Automation""}",2025-04-27 16:11:27.068127,2025-04-27 16:11:27.068127
257,OptimoRoute,Route Optimization,Commercial,"OptimoRoute uses advanced algorithms and machine learning to optimize routes and schedules for mobile workforces. It is particularly useful for sales representatives as it plans efficient routes and schedules, considering factors like traffic, delivery times, and customer preferences.",https://optimoroute.com,"{AI,""Route Optimization"",""Itinerary Planning"",""Sales Efficiency""}",2025-04-27 16:11:27.165045,2025-04-27 16:11:27.165045
258,Route4Me,Logistics,Freemium,Route4Me provides dynamic route optimization software designed to use AI to ensure the most efficient routes for its users. It supports all types of routing needs including those of sales professionals managing client visits across different locations. The tool also offers predictive data analytics for better decision-making.,https://www.route4me.com,"{Routing,AI,Logistics,""Sales Planning"",""Travel Optimization""}",2025-04-27 16:11:27.167013,2025-04-27 16:11:27.167013
259,Badger Maps,Sales Productivity,Commercial,"Badger Maps is a sales routing software that uses AI to analyze traffic data, optimize routes, and manage territories. It helps sales representatives plan their day by visualizing their customers on a map, creating efficient routes, and integrating with their calendar for seamless scheduling.",https://www.badgermapping.com,"{""Sales Routing"",AI,""Itinerary Optimization"",""Client Management""}",2025-04-27 16:11:27.167582,2025-04-27 16:11:27.167582
266,IBM Watson Commerce,AI in Commerce,Commercial,"IBM Watson Commerce uses AI to manage inventory levels and optimize pricing. It predicts demand using weather data, market trends, and consumer behavior insights, helping businesses adjust inventory and pricing dynamically.",https://www.ibm.com/products/watson-commerce,"{AI,""inventory management"",""dynamic pricing"",""demand forecasting""}",2025-04-27 16:11:27.170696,2025-04-27 16:11:27.170696
284,LinkSquares,Legal Tech,Commercial,"LinkSquares is an AI-powered contract analytics tool that helps companies analyze contract data to identify opportunities for new partnerships and business growth. It uses natural language processing to extract and interpret key contract terms and conditions, facilitating strategic decision-making.",https://linksquares.com/,"{AI,""Contract Analysis"",NLP,""Business Growth""}",2025-04-27 16:11:27.178277,2025-04-27 16:11:27.178277
248,Brainshark,Sales Training,Commercial,"Brainshark offers solutions for sales enablement and readiness, incorporating AI to create dynamic sales training and coaching modules. It supports the acquisition of deep product knowledge and advanced sales skills through engaging multimedia content, analytics, and AI-driven adaptive learning paths.",https://www.brainshark.com,"{""sales coaching"",""multimedia training"",""adaptive learning"",AI}",2025-04-27 16:11:27.049128,2025-04-27 16:11:27.221973
150,Whova,Event Management,Commercial,"Whova offers an AI-powered event management platform that assists organizers in selecting and optimizing events based on detailed analytics of past events, attendee preferences, and potential business impacts. Its AI engine recommends networking events that are most likely to improve engagement and ROI.",https://www.whova.com,"{AI,""Event Analytics"",""Networking Optimization"",""Strategic Planning""}",2025-04-27 16:11:27.004367,2025-04-27 16:11:27.282998
293,Workday Peakon Employee Voice,Employee Engagement,Commercial,"Workday Peakon Employee Voice uses real-time analytics and AI to measure employee engagement and provides insights to enhance workplace culture, including sales environments. It offers personalized insights and recommendations to boost morale and recognize achievements, which can be particularly beneficial in maintaining a positive sales culture.",https://www.workday.com/en-us/products/employee-engagement-software/overview.html,"{AI,""Employee Engagement"",""Morale Boosting"",""Sales Culture""}",2025-04-27 16:11:27.194458,2025-04-27 16:11:27.194458
294,Briq,Performance Management,Commercial,"Briq is a corporate performance management platform that uses AI to automate and enhance recognition programs within sales teams. It helps in setting up personalized rewards and recognition systems that are tailored to the sales culture of an organization, thereby boosting morale and enhancing overall sales performance.",https://www.briq.com/,"{AI,""Performance Management"",""Sales Culture"",Recognition}",2025-04-27 16:11:27.194969,2025-04-27 16:11:27.194969
295,Salesforce Einstein Analytics,Business Intelligence,Commercial,"Salesforce Einstein Analytics is an AI-powered analytics tool that provides actionable insights into team performance and customer interactions. It can be used to track and recognize sales achievements, analyze trends in sales team morale, and offer personalized coaching insights, thereby fostering a positive sales culture.",https://www.salesforce.com/products/einstein-analytics/overview/,"{AI,Analytics,""Sales Culture"",""Motivational Insights""}",2025-04-27 16:11:27.195574,2025-04-27 16:11:27.195574
229,Allego,Sales Training,Commercial,"Allego offers a modern sales learning and readiness platform that uses AI to optimize learning retention through personalized content delivery and reinforcement training. The platform is particularly effective for complex product training, helping sales representatives to quickly adapt to market changes and product updates.",https://www.allego.com,"{""sales learning"",AI-driven,""personalized learning"",""product expertise""}",2025-04-27 16:11:27.03169,2025-04-27 16:11:27.196563
304,Plum,Human Resources,Commercial,"Plum uses AI to predict how well potential and existing employees will succeed in their roles and fit within a team. By assessing talents through psychometric tests and matching them to job needs, Plum helps in building teams that are aligned with organizational goals and culture.",https://www.plum.io,"{""psychometric testing"",""team development"",""employee assessment""}",2025-04-27 16:11:27.225213,2025-04-27 16:11:27.225213
303,HireVue,Recruitment,Commercial,"HireVue leverages AI to enhance the hiring process by providing video interviewing and pre-employment assessment solutions. It uses machine learning algorithms to analyze verbal and non-verbal communication in interviews, helping organizations identify the best candidates who fit their team culture and performance standards.",https://www.hirevue.com,"{""AI recruitment"",""video interviewing"",""team building"",""machine learning""}",2025-04-27 16:11:27.224767,2025-04-27 16:11:27.226456
305,Pymetrics,Recruitment,Commercial,Pymetrics applies AI in the form of neuroscience-based games and bias-free algorithms to match candidates’ emotional and cognitive abilities with company profiles. This tool is used for both recruiting new team members and managing workforce development.,https://www.pymetrics.ai,"{neuroscience,""workforce development"",""AI hiring"",""team building""}",2025-04-27 16:11:27.225609,2025-04-27 16:11:27.226875
309,Eightfold,Talent Management,Commercial,"Eightfold's Talent Intelligence Platform uses AI to transform recruiting, talent management, and workforce planning. It provides insights and recommendations to manage and develop talent effectively.",https://www.eightfold.ai,"{""Talent Intelligence"",""AI Recruitment"",""Workforce Planning"",""Talent Development""}",2025-04-27 16:11:27.227367,2025-04-27 16:11:27.227367
310,Entelo,Recruitment,Commercial,Entelo applies AI to streamline the recruitment process by automating candidate search and outreach. It uses predictive analytics to identify the best candidates and improve diversity hiring.,https://www.entelo.com,"{""Predictive Analytics"",""Talent Acquisition"",""Diversity Hiring"",""Candidate Search""}",2025-04-27 16:11:27.227739,2025-04-27 16:11:27.227739
311,Beamery,Talent Acquisition,Commercial,Beamery combines elements of CRM and ATS with AI to provide a complete talent acquisition solution. It helps in nurturing candidate relationships and improving the quality of hires.,https://www.beamery.com,"{CRM,ATS,""Candidate Relationship"",""AI Recruitment""}",2025-04-27 16:11:27.228226,2025-04-27 16:11:27.228226
306,Culture Amp,Employee Engagement,Commercial,"Culture Amp uses AI and analytics to help companies manage and develop their teams. It provides insights into employee engagement and performance, facilitating better decision-making in team development and retention strategies.",https://www.cultureamp.com,"{""employee engagement"",""performance management"",""AI analytics""}",2025-04-27 16:11:27.226038,2025-04-27 16:11:27.228662
313,Humu,Human Resources,Commercial,"Humu leverages behavioral science and AI to nudge employees towards better work habits. It analyzes organizational data to deliver personalized nudges to employees, helping to align their behaviors with the company's cultural values and goals.",https://www.humu.com,"{""Behavioral Science"",AI,Nudges,""Organizational Culture""}",2025-04-27 16:11:27.229134,2025-04-27 16:11:27.229134
314,Leapsome,Performance Management,Commercial,"Leapsome combines tools for performance management, employee engagement, and learning that are powered by AI. It provides frameworks for feedback, goals, and development plans that align with an organization's culture, helping to reinforce and evolve it over time.",https://www.leapsome.com,"{AI,""Employee Engagement"",""Performance Management"",""Culture Development""}",2025-04-27 16:11:27.229527,2025-04-27 16:11:27.229527
315,Glint,Employee Engagement,Commercial,"Glint uses AI to analyze employee survey data to provide insights into organizational health and employee well-being. It helps leaders identify areas of cultural strength and opportunities for development, supporting strategic culture change initiatives.",https://www.glintinc.com,"{AI,Surveys,""Employee Well-being"",""Organizational Culture""}",2025-04-27 16:11:27.2301,2025-04-27 16:11:27.2301
316,WorkBoard,Business Management,Commercial,"WorkBoard is an AI-powered enterprise platform that helps organizations with strategic planning, alignment, and execution. It enables leaders to define strategic priorities, align teams with these objectives, and use real-time data to adapt strategies as market conditions change.",https://www.workboard.com,"{""strategic planning"",execution,alignment,""real-time data"",enterprise}",2025-04-27 16:11:27.230674,2025-04-27 16:11:27.230674
319,ClearPoint Strategy,Strategy Management,Commercial,"ClearPoint Strategy is a strategy management software that integrates management reporting, strategic planning, and execution into one platform. It provides tools for setting and tracking objectives, measuring performance, and adjusting strategies based on analytical insights.",https://www.clearpointstrategy.com,"{""strategy management"",reporting,""performance measurement"",analytics}",2025-04-27 16:11:27.231914,2025-04-27 16:11:27.231914
324,Replika,AI Chatbot,Freemium,"Replika is an AI companion designed to communicate with users in a conversational manner, adapting its responses to improve emotional connection and trust. It uses machine learning to understand and mimic human emotions, making it suitable for building rapport with users.",https://replika.ai,"{""AI companion"",""emotional intelligence"",chatbot,""trust building"",rapport}",2025-04-27 16:11:27.234418,2025-04-27 16:11:27.234418
325,Cognito,AI Communication Coach,Commercial,"Cognito is designed for customer support and sales teams to enhance their communication skills. It uses AI to analyze voice during calls and provides real-time feedback and guidance on how to better engage and build trust with clients, thereby improving rapport.",https://www.cognitohq.com,"{""real-time feedback"",""voice analysis"",""customer support"",""sales enhancement"",""trust development""}",2025-04-27 16:11:27.235002,2025-04-27 16:11:27.235002
326,Crystal,AI Personality Insights,Commercial,"Crystal uses AI to analyze public data and personality assessments to provide insights into the best ways to communicate with specific individuals. It helps users tailor their interactions based on personality types, significantly enhancing the ability to build rapport and trust.",https://www.crystalknows.com,"{""personality analysis"",""communication strategies"",""personalized interaction"",""rapport building"",""trust development""}",2025-04-27 16:11:27.235355,2025-04-27 16:11:27.235355
327,Vidyard,Video Marketing,Freemium,"Vidyard is a video platform that allows businesses to create personalized video demonstrations using AI. It can tailor content based on viewer data and engagement, making it suitable for AI-enhanced product demonstrations.",https://www.vidyard.com/,"{""AI Video"",Personalization,Marketing,Sales}",2025-04-27 16:11:27.235725,2025-04-27 16:11:27.235725
328,Smartly.io,Advertising,Commercial,"Smartly.io leverages AI to automate and optimize personalized advertising content. It can be used to create dynamic product demonstrations that adapt to the user's behavior and preferences, enhancing the relevance of the demonstration.",https://www.smartly.io/,"{""AI Advertising"",Personalization,""Dynamic Content"",""Marketing Automation""}",2025-04-27 16:11:27.236099,2025-04-27 16:11:27.236099
329,Ceros,Content Creation,Commercial,"Ceros is an interactive content creation platform that integrates AI to design engaging and personalized digital experiences. It can be used to create interactive product demonstrations that respond to user interactions, providing a tailored demonstration experience.",https://www.ceros.com/,"{""Interactive Content"",""AI Design"",""Digital Experience"",""Product Demonstration""}",2025-04-27 16:11:27.236496,2025-04-27 16:11:27.236496
336,Qualtrics XM,Experience Management,Commercial,"Qualtrics XM is an experience management platform that uses AI to analyze feedback from various sources across an organization. It integrates data from marketing, sales, and product teams to provide insights and actionable recommendations for improving messaging and product offerings.",https://www.qualtrics.com,"{""feedback analysis"",cross-functional,AI-driven,""real-time insights""}",2025-04-27 16:11:27.239018,2025-04-27 16:11:27.239018
339,Calendly,Scheduling,Freemium,"Calendly helps automate the process of scheduling appointments by allowing users to set their availability preferences. It integrates seamlessly with Google, Outlook, Office 365, and iCloud calendars to avoid double-booking and provides automated email and SMS reminders to both parties involved.",https://calendly.com,"{""appointment scheduling"",""calendar integration"",""automated reminders"",""time management""}",2025-04-27 16:11:27.24024,2025-04-27 16:11:27.27979
