tool_id,tool_name,primary_category,license_type,description,website_url,tags,created_at,updated_at
1,Google Cloud Natural Language API,NLP,Commercial,"Google Cloud Natural Language API uses machine learning to understand text and extract information about people, places, and events. It provides features like sentiment analysis, entity analysis, and syntax analysis, enabling applications to understand the context and meaning of text.",https://cloud.google.com/natural-language,"{NLP,""machine learning"",""text analysis"",""Google Cloud""}",2025-04-27 16:11:26.908224,2025-04-27 16:11:26.908224
2,IBM Watson Natural Language Understanding,NLP,Commercial,"IBM Watson Natural Language Understanding is a cloud-native product that uses deep learning to analyze text for concepts, entities, keywords, categories, sentiment, emotion, and more. It helps businesses to understand complex text and make better data-driven decisions.",https://www.ibm.com/cloud/watson-natural-language-understanding,"{NLP,""IBM Watson"",""text analytics"",""sentiment analysis""}",2025-04-27 16:11:26.922195,2025-04-27 16:11:26.922195
3,spaCy,NLP,Open Source,"spaCy is an open-source software library for advanced natural language processing, designed specifically for production use. It supports over 60 languages and offers features like tokenization, named entity recognition, part of speech tagging, and dependency parsing.",https://spacy.io,"{NLP,""open source"",""text processing"",""language models""}",2025-04-27 16:11:26.923673,2025-04-27 16:11:26.923673
16,Tableau,Data Visualization,Commercial,"Tableau is a powerful data visualization tool that allows users to create interactive and shareable dashboards. It helps in analyzing sales data by providing features like trend analysis, forecasting, and segmentation, which can be used to identify patterns and opportunities in sales data.",https://www.tableau.com,"{""data visualization"",""sales analysis"",""trend analysis"",forecasting}",2025-04-27 16:11:26.938372,2025-04-27 16:11:26.989235
6,Hugging Face Transformers,NLP,Open Source,"Transformers library by Hugging Face provides state-of-the-art general-purpose architectures for natural language understanding and generation. It includes thousands of pre-trained models, including models for text response generation like BERT, GPT-2, and RoBERTa, which can be fine-tuned for specific tasks.",https://huggingface.co/transformers,"{AI,NLP,""machine learning"",""Hugging Face"",Transformers,""text generation""}",2025-04-27 16:11:26.928154,2025-04-27 16:11:26.928154
8,Google Cloud Natural Language AI,NLP,Commercial,"Google Cloud Natural Language AI provides a suite of language understanding technologies, including an API that can be used for generating text responses. It leverages Google's machine learning technology to understand and generate human-like text for a variety of applications.",https://cloud.google.com/natural-language,"{AI,NLP,""Google Cloud"",""text generation"",""machine learning""}",2025-04-27 16:11:26.930297,2025-04-27 16:11:26.930297
9,Elasticsearch,Search Engine,Open Source,"Elasticsearch is a distributed, RESTful search and analytics engine capable of addressing a large number of use cases, including knowledge base integration. It allows users to store, search, and analyze big volumes of data quickly and in near real time. Elasticsearch is commonly used to enable search capabilities over documents and content within a knowledge base.",https://www.elastic.co/elasticsearch/,"{""search engine"",analytics,""big data"",real-time}",2025-04-27 16:11:26.931294,2025-04-27 16:11:26.931294
10,Algolia,Search API,Freemium,"Algolia provides a hosted search API that enables developers to integrate search functionality into their applications and knowledge bases. It offers a powerful, fast, and scalable search experience with features like typo tolerance, filters, and synonyms that enhance the retrieval of information from knowledge repositories.",https://www.algolia.com/,"{""hosted API"",search,scalable,""typo tolerance""}",2025-04-27 16:11:26.932613,2025-04-27 16:11:26.932613
11,Apache Solr,Search Platform,Open Source,"Apache Solr is an open-source search platform built on Apache Lucene. It is highly reliable, scalable, and fault tolerant, providing distributed indexing, replication, and load-balanced querying with a centralized configuration. Solr is widely used for enterprise search and analytics use cases, including integrating with knowledge bases to facilitate information retrieval.",https://solr.apache.org/,"{""enterprise search"",indexing,""Apache Lucene"",scalable}",2025-04-27 16:11:26.933669,2025-04-27 16:11:26.933669
12,Microsoft Azure Cognitive Search,Cloud Search Service,Commercial,"Azure Cognitive Search is a cloud search service with built-in AI capabilities that enrich all types of information to easily identify and explore relevant content at scale. It supports integration with knowledge bases, providing capabilities such as natural language processing, AI-powered insights, and complex search queries over structured and unstructured data.",https://azure.microsoft.com/en-us/services/search/,"{""cloud service"",""AI capabilities"",NLP,""data insights""}",2025-04-27 16:11:26.934705,2025-04-27 16:11:26.934705
13,RFPIO,Document Processing,Commercial,RFPIO is a response management platform that uses AI to help streamline the process of responding to RFPs (Request for Proposals). It features advanced capabilities to automatically extract questions from RFP documents and uses a content library to generate accurate and relevant draft responses. This helps organizations save time and improve the quality of their proposal submissions.,https://www.rfpio.com,"{RFP,automation,""document processing"",AI,""proposal management""}",2025-04-27 16:11:26.935659,2025-04-27 16:11:26.935659
14,Loopio,Document Processing,Commercial,"Loopio is a platform designed to help businesses manage RFP responses more efficiently. It leverages machine learning to automatically extract questions from RFPs and populate answers using a pre-built library. Loopio also facilitates collaboration among team members, making it easier to craft tailored responses to complex RFPs.",https://www.loopio.com,"{RFP,""response automation"",collaboration,""machine learning""}",2025-04-27 16:11:26.936478,2025-04-27 16:11:26.936478
15,Qvidian,Document Processing,Commercial,"Qvidian by Upland Software offers automated RFP and proposal generation tools that help organizations increase efficiency in their sales cycles. The tool uses AI to analyze RFP documents, extract pertinent questions, and assist in creating detailed, customized responses based on a centralized content database.",https://uplandsoftware.com/qvidian/,"{RFP,""proposal automation"",""sales enablement"",""content management""}",2025-04-27 16:11:26.9376,2025-04-27 16:11:26.9376
7,IBM Watson Assistant,NLP,Commercial,"IBM Watson Assistant is a conversational AI platform designed to generate human-like text responses in various applications, such as customer service bots. It uses natural language understanding and machine learning to interpret user inputs and generate relevant responses.",https://www.ibm.com/cloud/watson-assistant,"{AI,NLP,""IBM Watson"",chatbot,""customer service""}",2025-04-27 16:11:26.929249,2025-04-27 16:11:27.258134
17,Microsoft Power BI,Business Intelligence,Freemium,"Microsoft Power BI is a suite of business analytics tools that deliver insights throughout your organization. It enables users to connect to hundreds of data sources, simplify data prep, and drive ad hoc analysis for sales data. Power BI provides robust analytics and reporting features to help identify trends and opportunities in sales.",https://powerbi.microsoft.com,"{""business intelligence"",""data analysis"",reporting,""sales data""}",2025-04-27 16:11:26.939293,2025-04-27 16:11:26.939293
18,Looker,Business Intelligence,Commercial,"Looker is a business intelligence software and big data analytics platform that helps you explore, analyze and share real-time business analytics easily. It facilitates the analysis of sales data through its robust data modeling and visualization capabilities, helping businesses uncover trends and make data-driven decisions.",https://looker.com,"{""business intelligence"",""data analytics"",visualization,""sales trends""}",2025-04-27 16:11:26.941858,2025-04-27 16:11:26.941858
19,Sisense,Business Intelligence,Commercial,Sisense empowers analysts and business users to simplify complex data and provide insights using powerful dashboarding and data analytics tools. It supports sales data analysis by allowing users to merge data from different sources and visualize data to identify trends and generate actionable insights.,https://www.sisense.com,"{""data integration"",analytics,dashboard,""sales insights""}",2025-04-27 16:11:26.942873,2025-04-27 16:11:26.942873
20,Qlik Sense,Data Visualization,Commercial,"Qlik Sense is a self-service data analytics and visualization tool that uses an associative analytics engine, sophisticated AI, and high performance cloud platform to help users make data-driven decisions. It is particularly effective in analyzing sales data, offering dynamic visualizations and interactive dashboards for spotting trends and opportunities.",https://www.qlik.com,"{""data visualization"",""self-service analytics"",AI,""sales data analysis""}",2025-04-27 16:11:26.943907,2025-04-27 16:11:26.943907
4,OpenAI GPT-3,NLP,Commercial,"GPT-3, developed by OpenAI, is one of the most powerful language processing AI models available. It excels in understanding and generating human-like text, enabling applications to perform tasks like translation, summarization, and question answering.",https://openai.com/gpt-3,"{NLP,OpenAI,""language model"",""text generation""}",2025-04-27 16:11:26.925021,2025-04-27 16:11:26.944898
22,Jasper,Content Creation,Commercial,"Jasper is an AI-powered content generation tool that helps users create high-quality content for blogs, social media, websites, and more. It uses machine learning to understand context and generate relevant and engaging content.",https://www.jasper.ai,"{""content marketing"",""AI writer"",""blogging tool"",""content automation""}",2025-04-27 16:11:26.945789,2025-04-27 16:11:26.945789
23,Writesonic,Content Creation,Freemium,"Writesonic is an AI tool designed to help with marketing content creation, including ads, emails, and blog posts. It uses artificial intelligence to generate creative and compelling text that captures attention and engages readers.",https://writesonic.com,"{""digital marketing"",""AI content generator"",""copywriting tool"",""content creation""}",2025-04-27 16:11:26.946558,2025-04-27 16:11:26.946558
24,CopyAI,Content Creation,Freemium,"CopyAI is an automated copywriting tool that uses AI to help users generate marketing copy instantly. It's designed to produce various types of content such as social media posts, blog posts, and email newsletters.",https://www.copy.ai,"{""AI copywriting"",""content generation"",""marketing tool"",""AI marketing""}",2025-04-27 16:11:26.947293,2025-04-27 16:11:26.947293
30,Copy.ai,AI Writing Assistant,Freemium,"Copy.ai is an AI-powered tool that assists in generating marketing copy, including value propositions. It uses advanced algorithms to understand the product features and benefits, tailoring the communication to meet the specific needs of the target audience.",https://www.copy.ai,"{Copywriting,""AI Tool"",Marketing,""Value Proposition"",Automation}",2025-04-27 16:11:26.951697,2025-04-27 16:11:26.951697
27,Anaplan,Business Planning,Commercial,"Anaplan's Connected Planning platform leverages AI to help sales teams manage and achieve their quotas. It provides tools for sales planning, forecasting, and scenario analysis, which help in making informed decisions to meet sales targets.",https://www.anaplan.com/,"{""Sales Planning"",AI,Forecasting,""Quota Management""}",2025-04-27 16:11:26.949362,2025-04-27 16:11:27.23151
28,Persado,Marketing Automation,Commercial,Persado uses AI to generate persuasive language for communications tailored to audience segments. This tool leverages natural language processing and machine learning to craft messages that effectively communicate the value propositions of products or services to different customer profiles.,https://www.persado.com,"{""AI Marketing"",NLP,""Machine Learning"",""Value Proposition"",""Customer Engagement""}",2025-04-27 16:11:26.950138,2025-04-27 16:11:26.992635
29,Phrasee,Content Generation,Commercial,"Phrasee uses AI to power its language generation for marketing copy, focusing on creating brand-consistent, engaging content that communicates a product’s value proposition effectively. It analyzes existing marketing language and audience reactions to tailor messages that resonate with specific customer segments.",https://www.phrasee.co,"{""Content Marketing"",""AI Writing"",""Email Marketing"",Personalization,""Value Communication""}",2025-04-27 16:11:26.950801,2025-04-27 16:11:26.992991
33,Outreach,Sales Engagement,Commercial,"Outreach is a sales engagement platform that leverages AI to optimize customer interactions. It assists sales leaders by automating routine tasks, providing actionable insights, and enabling personalized communication strategies that can influence sales outcomes.",https://www.outreach.io/,"{""sales automation"",AI,""customer engagement"",""sales productivity""}",2025-04-27 16:11:26.954079,2025-04-27 16:11:27.259027
26,Xactly,Sales Performance Management,Commercial,"Xactly offers a comprehensive suite of AI-driven sales performance management tools that help in setting, tracking, and analyzing sales quotas. It uses data-driven insights to optimize sales strategies and improve quota attainment.",https://www.xactlycorp.com/,"{""Sales Management"",""Performance Tracking"",AI,""Quota Achievement""}",2025-04-27 16:11:26.948722,2025-04-27 16:11:27.258735
31,Salesforce Einstein,CRM AI,Commercial,"Salesforce Einstein is an AI layer integrated within the Salesforce platform that enhances CRM capabilities by providing AI-driven insights, predictions, and recommendations. It helps sales leaders by analyzing customer data to offer guidance on the most effective sales strategies and personalizing customer interactions to drive sales.",https://www.salesforce.com/products/einstein/overview/,"{AI,CRM,""sales automation"",""customer insights"",""sales leadership""}",2025-04-27 16:11:26.9523,2025-04-27 16:11:27.270266
39,Microsoft Dynamics 365 Sales,CRM,Commercial,"Microsoft Dynamics 365 Sales integrates AI-driven insights to facilitate collaborative territory management. It helps in defining and managing territories, using AI to forecast sales and identify high-potential accounts within those territories. The platform supports collaboration across teams, ensuring aligned goals and strategies.",https://dynamics.microsoft.com/en-us/sales/overview/,"{""AI insights"",""territory management"",forecasting,collaboration}",2025-04-27 16:11:26.957899,2025-04-27 16:11:26.957899
42,Prisync,Pricing Intelligence,Commercial,"Prisync is a competitor price tracking and monitoring software for all sizes of e-commerce companies worldwide. It helps businesses to demonstrate competitive pricing strategies by providing detailed comparisons and analytics, which can be used to highlight cost advantages in product demonstrations.",https://www.prisync.com,"{""price tracking"",e-commerce,""competitive pricing""}",2025-04-27 16:11:26.959656,2025-04-27 16:11:26.959656
34,Drift,Conversational AI,Commercial,"Drift is an AI-powered conversational marketing platform that engages with potential customers at the early stages of the sales cycle. It provides personalized chatbot interactions that can demonstrate products, answer queries, and guide users through initial sales processes, effectively enhancing client understanding and engagement.",https://www.drift.com,"{""AI chatbot"",""sales support"",""customer engagement"",""conversational marketing""}",2025-04-27 16:11:26.954876,2025-04-27 16:11:27.266029
56,Chorus.ai,Sales Enablement,Commercial,"Chorus.ai is an AI-driven platform that records, transcribes, and analyzes sales calls to provide actionable insights. It helps in mentoring junior sales staff by identifying successful sales tactics and areas for improvement, offering personalized feedback based on real sales interactions.",https://www.chorus.ai,"{AI,""Sales Training"",Mentorship,""Call Analysis""}",2025-04-27 16:11:26.9668,2025-04-27 16:11:27.27663
45,Trello,Project Management,Freemium,"Trello is a web-based Kanban-style list-making application which is great for managing projects across sales and technical teams. It allows users to create tasks, assign them to team members, and track progress collaboratively.",https://trello.com,"{""project management"",kanban,""task management"",collaboration,sales,technical}",2025-04-27 16:11:26.961074,2025-04-27 16:11:27.263766
46,Microsoft Teams,Communication,Commercial,"Microsoft Teams is a unified communication and collaboration platform that combines persistent workplace chat, video meetings, file storage, and application integration. It is designed to help teams collaborate more effectively, and integrates with various sales and technical tools.",https://teams.microsoft.com,"{communication,collaboration,meetings,chat,sales,technical}",2025-04-27 16:11:26.961711,2025-04-27 16:11:27.262786
43,Owler,Business Intelligence,Freemium,"Owler offers news alerts, company profiles, and polls about competitors, which can be leveraged to understand and demonstrate a product's unique position and advantages in the market.",https://www.owler.com,"{""company news"",""competitive insights"",""market trends""}",2025-04-27 16:11:26.960149,2025-04-27 16:11:27.274013
40,Crayon,Competitive Intelligence,Commercial,"Crayon provides a competitive intelligence platform that enables businesses to track, analyze, and act on everything happening outside their four walls. Its features include capturing and analyzing competitor data which can be used to highlight a product's competitive advantages in demonstrations.",https://www.crayon.co,"{""competitive analysis"",""market intelligence"",""product demonstration""}",2025-04-27 16:11:26.958366,2025-04-27 16:11:27.272549
50,HubSpot Sales Hub,Sales Automation,Freemium,HubSpot Sales Hub utilizes machine learning to provide sales teams with insights into the most effective sales strategies and customer engagement techniques. It adapts recommendations based on ongoing sales data and market conditions.,https://www.hubspot.com/products/sales,"{""sales automation"",AI,""machine learning"",""dynamic sales strategy""}",2025-04-27 16:11:26.963637,2025-04-27 16:11:27.269123
44,Slack,Communication,Freemium,Slack is a messaging app for teams that makes it easy for sales teams to communicate with technical departments in real-time. It supports integration with various AI and automation tools to streamline workflows and enhance collaboration.,https://slack.com,"{messaging,collaboration,real-time,integration,sales,technical}",2025-04-27 16:11:26.960616,2025-04-27 16:11:27.263062
25,Clari,Sales Performance Management,Commercial,"Clari uses AI to enhance visibility into the sales process, helping sales teams to forecast and manage quotas more effectively. It provides real-time insights into sales performance and predictive analytics to guide sales strategies, ensuring quota achievement.",https://www.clari.com/,"{AI,""Sales Forecasting"",""Quota Management"",""Predictive Analytics""}",2025-04-27 16:11:26.947959,2025-04-27 16:11:27.274849
41,Kompyte,Competitive Intelligence,Commercial,Kompyte helps companies track their competitors in real-time and automatically reacts to their moves. It provides insights and analytics that can be used to demonstrate a product's superiority over competitors during sales pitches and marketing campaigns.,https://www.kompyte.com,"{""real-time tracking"",""competitive analysis"",""sales enablement""}",2025-04-27 16:11:26.959101,2025-04-27 16:11:27.25281
38,Zoho CRM,CRM,Freemium,"Zoho CRM offers territory management that helps businesses design and manage multiple territories by analyzing sales performance and potential. It features collaborative tools that enable teams to work together in real-time, ensuring efficient territory alignment and maximizing sales opportunities.",https://www.zoho.com/crm/,"{""territory management"",""real-time collaboration"",""sales analytics"",CRM}",2025-04-27 16:11:26.957306,2025-04-27 16:11:27.275108
47,Asana,Project Management,Freemium,"Asana is a project management tool that helps teams organize, track, and manage their work. It's particularly useful for sales and technical teams to collaborate on projects, with features that facilitate task assignments, deadlines, and updates.",https://asana.com,"{""project management"",""task tracking"",collaboration,sales,technical}",2025-04-27 16:11:26.962219,2025-04-27 16:11:27.263352
37,Salesforce Sales Cloud,CRM,Commercial,"Salesforce Sales Cloud provides advanced AI capabilities through its Einstein AI platform, which includes features for collaborative territory management. It allows sales teams to plan and optimize territories based on historical data and predictive analytics, enhancing collaboration and strategic decision-making.",https://www.salesforce.com/products/sales-cloud/overview/,"{""collaborative territory management"",""sales optimization"",""predictive analytics"",CRM}",2025-04-27 16:11:26.956642,2025-04-27 16:11:27.274591
66,Kissflow,Workflow Automation,Freemium,"Kissflow is a cloud-based workflow and process automation platform that enables organizations to manage, automate, and optimize their business processes. It empowers employees to contribute to operational improvements by providing tools to create and modify workflows, thereby fostering a culture of continuous innovation.",https://kissflow.com/,"{""workflow automation"",""process management"",""continuous improvement"",innovation}",2025-04-27 16:11:26.971076,2025-04-27 16:11:26.971076
70,Nudge.ai,Relationship Intelligence,Commercial,Nudge.ai is an AI-powered platform that provides relationship intelligence. It helps businesses understand and leverage their relationships with executives by offering actionable insights based on communication patterns and network strength.,https://nudge.ai/,"{""AI networking"",""executive relationships"",""business intelligence""}",2025-04-27 16:11:26.972594,2025-04-27 16:11:26.972594
71,BoardEx,Analytics,Commercial,"BoardEx is an advanced analytics platform that focuses on relationship mapping. It helps organizations identify and leverage connections with key executives, providing detailed profiles and relationship strength indicators.",https://www.boardex.com/,"{""executive relationships"",""relationship mapping"",""strategic planning""}",2025-04-27 16:11:26.972949,2025-04-27 16:11:26.972949
73,PathFactory,Content Marketing,Commercial,"PathFactory employs AI to analyze customer engagement with content across various channels, helping businesses understand customer interests and pain points. This data allows companies to develop a deep understanding of the customer's business needs and tailor their marketing and sales strategies accordingly.",https://www.pathfactory.com,"{""Content Engagement"",AI,""Marketing Automation"",""Customer Understanding""}",2025-04-27 16:11:26.973748,2025-04-27 16:11:26.973748
77,Zilliant IQ,Pricing and Sales Optimization,Commercial,Zilliant IQ is an AI-driven pricing and sales solution that optimizes pricing strategies and identifies sales opportunities. It supports strategic account leadership by enabling personalized account planning and execution strategies based on comprehensive data analysis.,https://www.zilliant.com/solutions/zilliant-iq,"{AI,""pricing strategy"",""sales optimization"",""account management"",""data analysis""}",2025-04-27 16:11:26.975277,2025-04-27 16:11:26.975277
58,Jiminny,Sales Training,Commercial,"Jiminny is a platform designed for coaching and developing sales teams. It uses AI to capture and analyze sales conversations, providing feedback and training modules tailored to individual needs, thereby enhancing the mentorship process for junior sales staff.",https://www.jiminny.com,"{AI,""Sales Development"",""Training Platform"",""Conversation Intelligence""}",2025-04-27 16:11:26.967734,2025-04-27 16:11:27.262256
85,Hubdoc,Financial Document Management,Commercial,"Hubdoc is a financial document automation tool that automatically collects bank statements, bills, and receipts from various sources, using AI to extract key data and organize documents efficiently. It integrates with accounting software like Xero to streamline financial document management.",https://www.hubdoc.com,"{""document automation"",""financial management"",""data extraction""}",2025-04-27 16:11:26.978367,2025-04-27 16:11:26.978367
86,AutoEntry,Data Entry Automation,Commercial,"AutoEntry is an AI-powered tool that automates data entry by capturing, analyzing, and organizing financial documents. It supports a wide range of document types including bills, invoices, and receipts, making it ideal for preparing for financial meetings by ensuring all documents are accurately organized and accessible.",https://www.autoentry.com,"{""data capture"",""financial documents"",automation}",2025-04-27 16:11:26.978978,2025-04-27 16:11:26.978978
