tool_id,tool_name,primary_category,license_type,description,website_url,tags,created_at,updated_at
68,Monday.com,Project Management,Freemium,"Monday.com is a work operating system that allows teams to create workflow apps in minutes to run their processes, projects, and everyday work. Tools within Monday.com enable teams to continuously improve operational processes and foster innovation through better collaboration and workflow customization.",https://monday.com,"{""project management"",""workflow customization"",collaboration,innovation}",2025-04-27 16:11:26.971835,2025-04-27 16:11:27.251781
74,Node,AI Analytics,Commercial,"Node uses artificial intelligence to discover new business opportunities by analyzing relationships between people, companies, products, and markets. This tool helps in understanding the customer's business context, strategic goals, and industry dynamics, enabling personalized solution offerings.",https://www.node.io,"{AI,""Business Development"",""Market Intelligence"",Personalization}",2025-04-27 16:11:26.974076,2025-04-27 16:11:27.178667
65,Pega Platform,Business Process Management,Commercial,"Pega Platform is a digital process automation tool that helps organizations streamline operations and improve customer engagement. It provides AI-powered decisioning capabilities that allow employees to optimize and innovate operational processes, enhancing productivity and customer satisfaction.",https://www.pega.com/,"{""process automation"",""AI decisioning"",""customer engagement"",innovation}",2025-04-27 16:11:26.970511,2025-04-27 16:11:27.254445
64,UiPath,Robotic Process Automation,Commercial,"UiPath is a Robotic Process Automation (RPA) tool that helps businesses automate repetitive tasks. It can be used to improve operational processes by enabling employees to design automation workflows, which can lead to increased efficiency and innovation in daily operations.",https://www.uipath.com/,"{RPA,automation,""operational efficiency"",innovation}",2025-04-27 16:11:26.970087,2025-04-27 16:11:27.253793
69,Affinity,CRM,Commercial,Affinity uses AI to analyze communication data and automatically capture relationship insights. It helps users manage executive relationships by providing insights into interaction histories and suggesting the best paths to strengthen these connections.,https://www.affinity.co/,"{""relationship management"",""executive engagement"",""AI CRM""}",2025-04-27 16:11:26.972253,2025-04-27 16:11:27.272854
59,MindTickle,Sales Enablement,Commercial,"MindTickle offers a sales readiness platform that uses AI to provide data-driven insights for sales training and coaching. It helps in creating personalized learning paths for junior sales staff, ensuring they are trained based on proven best practices and individual performance metrics.",https://www.mindtickle.com,"{""Sales Readiness"",""AI Training"",""Personalized Learning"",""Sales Performance""}",2025-04-27 16:11:26.968101,2025-04-27 16:11:27.178983
67,IBM Watson,AI Platform,Commercial,"IBM Watson offers AI and machine learning solutions that can be applied across various business operations to enhance decision-making and process efficiencies. It supports operational improvement by providing insights and predictive analytics, enabling employees to innovate and improve their work processes.",https://www.ibm.com/watson,"{AI,""machine learning"",""predictive analytics"",""operational improvement""}",2025-04-27 16:11:26.971452,2025-04-27 16:11:27.254771
87,Receipt Bank,Financial Document Management,Commercial,"Now known as Dext Prepare, this tool extracts information from financial documents using machine learning. It helps businesses collect, process, and store receipts, invoices, and other financial documents efficiently, ensuring that all necessary paperwork is prepared and organized before any financial meeting.",https://dext.com,"{""receipt management"",""invoice processing"",""document storage""}",2025-04-27 16:11:26.97932,2025-04-27 16:11:26.97932
89,Qualtrics CustomerXM,Customer Experience Management,Commercial,"Qualtrics CustomerXM uses machine learning and predictive analytics to monitor and analyze customer interactions across multiple channels. It provides insights into customer sentiment and behavior, helping businesses enhance their customer satisfaction strategies.",https://www.qualtrics.com/customer-experience/,"{""customer experience"",""predictive analytics"",""machine learning"",""customer insights""}",2025-04-27 16:11:26.980039,2025-04-27 16:11:26.980039
91,Zendesk,Customer Support,Commercial,"Zendesk provides a suite of tools including support, chat, and call center solutions that integrate AI to enhance customer service interactions. Its AI capabilities help in automating responses and analyzing customer satisfaction trends to improve service quality.",https://www.zendesk.com,"{""customer support"",""AI automation"",""service quality"",""customer satisfaction""}",2025-04-27 16:11:26.980847,2025-04-27 16:11:26.980847
102,Ada,Customer Support AI,Commercial,"Ada is an AI-powered platform that automates customer service interactions and provides technical consultation and support. It uses natural language processing to understand and respond to user inquiries, making it suitable for providing expert advice in technical fields.",https://www.ada.cx/,"{""AI Chatbot"",""Customer Service"",NLP,""Technical Support""}",2025-04-27 16:11:26.984695,2025-04-27 16:11:26.984695
103,Watson Assistant,AI Chatbot,Commercial,"IBM's Watson Assistant uses AI to help businesses build conversational interfaces into any application, device, or channel. It can be used for technical consultation by understanding complex technical queries and providing precise answers or guidance using its advanced natural language processing capabilities.",https://www.ibm.com/cloud/watson-assistant/,"{NLP,Chatbot,""Technical Support"",""AI Assistant""}",2025-04-27 16:11:26.985041,2025-04-27 16:11:26.985041
100,Freshsales,CRM AI,Commercial,"Freshsales by Freshworks uses AI to offer predictive contact scoring, which prioritizes leads based on their likelihood of conversion. It also features AI-driven insights for sales forecasting and customer engagement analysis.",https://www.freshworks.com/crm/sales/,"{CRM,""lead scoring"",""sales forecasting"",""customer insights""}",2025-04-27 16:11:26.984006,2025-04-27 16:11:27.269985
115,Market Explorer by SimilarWeb,Digital Market Intelligence,Commercial,"Market Explorer provides digital market intelligence by analyzing web traffic and engagement metrics. This tool helps businesses understand online market sizes, customer behaviors, and benchmark against competitors, which is vital for digital market expansion strategies.",https://www.similarweb.com/corp/solutions/market-research/,"{""market research"",""traffic analysis"",""competitive benchmarking"",""digital strategy""}",2025-04-27 16:11:26.989602,2025-04-27 16:11:26.989602
99,HubSpot CRM,CRM AI,Freemium,"HubSpot CRM integrates AI to streamline customer relationship management processes. It features tools for email scheduling, lead scoring, and chatbots that provide real-time assistance to customers, enhancing engagement and satisfaction.",https://www.hubspot.com/products/crm,"{CRM,""lead scoring"",chatbots,""customer support""}",2025-04-27 16:11:26.983667,2025-04-27 16:11:27.003368
88,Medallia,Customer Experience Management,Commercial,"Medallia captures customer feedback across web, mobile, and social channels, analyzes it in real-time, and delivers actionable insights to improve customer satisfaction. It uses advanced AI algorithms to understand customer sentiments and trends.",https://www.medallia.com,"{""customer feedback"",""AI analytics"",real-time,""customer satisfaction""}",2025-04-27 16:11:26.97967,2025-04-27 16:11:27.239366
105,Rasa,AI Framework,Open Source,Rasa is an open-source machine learning framework for automated text and voice-based conversations. Developers can use Rasa to create sophisticated AI assistants capable of providing technical consultation and support by understanding and processing user queries in a conversational context.,https://rasa.com/,"{""Open Source"",Chatbot,""Machine Learning"",""Technical Support""}",2025-04-27 16:11:26.985903,2025-04-27 16:11:27.033416
54,Gong.io,Sales Enablement,Commercial,Gong.io uses AI to analyze communication data within sales teams to provide insights into customer interactions and sales processes. It helps sales professionals understand what strategies work best at different stages of the sales cycle and how to tailor their approach to meet the needs of each deal.,https://www.gong.io/,"{AI,""Sales Cycle"",""Communication Analysis"",""Sales Strategy""}",2025-04-27 16:11:26.965915,2025-04-27 16:11:27.276908
104,Zendesk Answer Bot,Customer Support AI,Commercial,"Zendesk Answer Bot is designed to improve customer support by using machine learning to automatically respond to customer inquiries. It can be integrated into technical support scenarios to provide immediate, automated responses to technical questions, thereby enhancing the efficiency of support teams.",https://www.zendesk.com/service/answer-bot/,"{""Customer Support"",""AI Bot"",""Machine Learning"",""Technical Consultation""}",2025-04-27 16:11:26.985565,2025-04-27 16:11:27.257834
90,Clarabridge,Customer Feedback Analysis,Commercial,"Clarabridge offers a comprehensive solution for analyzing customer feedback from various sources including social media, emails, and call center communications. It uses natural language processing (NLP) to extract meaningful insights from unstructured data, aiding in customer satisfaction improvement.",https://www.clarabridge.com,"{NLP,""customer feedback"",""data analysis"",""customer satisfaction""}",2025-04-27 16:11:26.9804,2025-04-27 16:11:27.239849
101,Pipedrive,CRM AI,Commercial,Pipedrive incorporates AI to automate repetitive tasks and provide sales forecasting. Its AI capabilities help in managing leads and deals by predicting future sales outcomes and suggesting actions to improve sales processes.,https://www.pipedrive.com,"{CRM,""sales automation"",forecasting,""lead management""}",2025-04-27 16:11:26.984353,2025-04-27 16:11:27.268831
113,CB Insights,Market Intelligence,Commercial,"CB Insights leverages machine learning to analyze millions of data points on venture capital, startups, patents, partnerships, and news mentions to help companies discover and understand the competitive landscape in new markets. This tool is essential for developing informed market expansion strategies.",https://www.cbinsights.com/,"{""AI analytics"",""market trends"",""competitive analysis"",""strategic planning""}",2025-04-27 16:11:26.988578,2025-04-27 16:11:27.273711
122,Microsoft Dynamics 365 AI,Business Intelligence,Commercial,"This tool leverages AI to provide insights into business processes and customer needs, facilitating effective solution recommendations based on deep learning of company products. It helps in tailoring solutions to customer requirements and streamlining the implementation process.",https://dynamics.microsoft.com/en-us/ai/,"{""business intelligence"",""deep learning"",""solution advising""}",2025-04-27 16:11:26.992218,2025-04-27 16:11:26.992218
126,CrunchMetrics,Business Intelligence,Commercial,"CrunchMetrics uses advanced AI and machine learning technologies to analyze business data and provide insights into potential ROI from various strategies and investments. It helps businesses communicate these insights effectively to stakeholders, emphasizing the financial and strategic benefits of products or services.",https://www.crunchmetrics.ai,"{AI,""ROI Analysis"",""Machine Learning"",""Data Analytics""}",2025-04-27 16:11:26.993699,2025-04-27 16:11:26.993699
127,Proof BusinessGPS,Analytics,Commercial,"Proof BusinessGPS employs AI to forecast and measure the financial outcomes of different business strategies, including marketing and operational investments. It provides a clear visualization of ROI and strategic benefits, which can be crucial for presentations to high-value clients.",https://www.proofanalytics.ai,"{""ROI Forecasting"",""Financial Modeling"",""Strategic Planning"",AI}",2025-04-27 16:11:26.994079,2025-04-27 16:11:26.994079
128,ClearStory Data,Data Integration,Commercial,"ClearStory Data's platform leverages AI and machine learning to analyze and harmonize large amounts of data from disparate sources, providing insights that help businesses understand the ROI of their initiatives. This tool is particularly useful for communicating complex financial benefits to clients in a digestible format.",http://www.clearstorydata.com,"{""Data Analysis"",""Machine Learning"",""ROI Insights"",AI}",2025-04-27 16:11:26.994665,2025-04-27 16:11:26.994665
129,LinkedIn Sales Navigator,Sales Intelligence,Commercial,"LinkedIn Sales Navigator is an advanced sales tool that aids in the process of finding the right prospects to build trusted relationships. It leverages AI to provide recommendations based on combined user data and network interactions, which can be crucial for collaborative business development.",https://business.linkedin.com/sales-solutions/sales-navigator,"{sales,networking,AI,""business development"",""lead generation""}",2025-04-27 16:11:26.996445,2025-04-27 16:11:26.996445
163,Celonis,Process Mining,Commercial,"Celonis is a process mining tool that uses AI and machine learning to analyze business processes and identify inefficiencies. It provides insights and recommendations for process optimization, helping organizations to improve their operational efficiency.",https://www.celonis.com/,"{""process mining"",AI,""machine learning"",""process optimization""}",2025-04-27 16:11:27.009152,2025-04-27 16:11:27.009152
146,Einstein AI by Salesforce,CRM,Commercial,"Einstein AI integrates with Salesforce CRM to provide AI-driven insights, predictions, and recommendations. It helps in personalizing customer interactions based on their history and social data, enhancing relationship management.",https://www.salesforce.com/products/einstein/overview/,"{""AI CRM"",""customer engagement"",""predictive analytics"",""relationship management""}",2025-04-27 16:11:27.003037,2025-04-27 16:11:27.003037
149,Eventbrite,Event Management,Freemium,Eventbrite uses AI to provide insights and recommendations for event organizers to optimize event planning and execution. It analyzes historical data on event performance and attendee engagement to suggest the best types of events and networking opportunities that align with business goals.,https://www.eventbrite.com,"{""Event Planning"",AI,""Data Analysis"",Networking}",2025-04-27 16:11:27.004029,2025-04-27 16:11:27.004029
159,Guru,Knowledge Management,Freemium,"Guru is a knowledge management tool that uses AI to organize and deliver relevant product information to team members in real-time. It integrates with various communication platforms to ensure that all team members have access to the latest product updates and information, enhancing client interactions.",https://www.getguru.com,"{AI,""Knowledge Management"",Real-time,""Product Information""}",2025-04-27 16:11:27.007716,2025-04-27 16:11:27.007716
160,Bloomfire,Knowledge Management,Commercial,"Bloomfire is a platform that centralizes company knowledge, including detailed product information, and uses AI to make this data easily searchable and accessible. It helps ensure that all team members are on the same page regarding product features and updates, which is crucial for client interactions.",https://www.bloomfire.com,"{""Searchable Knowledge Base"",AI,""Product Knowledge"",""Client Interaction""}",2025-04-27 16:11:27.00813,2025-04-27 16:11:27.00813
148,Bizzabo,Event Management,Commercial,Bizzabo is an event management software that leverages AI to help businesses plan and optimize their events. It uses AI algorithms to analyze past event data and attendee behavior to recommend the most relevant events and meetings that could yield high ROI based on strategic importance.,https://www.bizzabo.com,"{AI,""Event Optimization"",Networking,ROI}",2025-04-27 16:11:27.003696,2025-04-27 16:11:27.067487
135,Seismic,Sales Enablement,Commercial,Seismic is a sales enablement platform that leverages AI to personalize sales materials and automate the preparation process. It ensures that sales teams are equipped with the right information and strategies throughout the sales cycle.,https://www.seismic.com,"{""Sales Content Management"",AI,Personalization,""Sales Automation""}",2025-04-27 16:11:26.998955,2025-04-27 16:11:27.221391
411,Talkdesk,AI Contact Center,Commercial,"Talkdesk offers an AI-powered contact center solution that excels in handling high volumes of phone calls. It features automated dialing, intelligent routing to connect prospects with the most appropriate agent, and AI-driven insights for lead qualification.",https://www.talkdesk.com,"{""automated dialing"",""AI routing"",""sales calls""}",2025-04-27 16:11:27.264749,2025-04-27 16:11:27.264749
137,Salesloft,Sales Engagement,Commercial,"Salesloft offers a powerful sales engagement platform equipped with AI capabilities to streamline the sales process. It features tools for email tracking, automated dialing, and personalized outreach, all designed to increase the efficiency and effectiveness of sales teams.",https://www.salesloft.com,"{""Sales Automation"",AI,""Email Tracking"",""Automated Dialing""}",2025-04-27 16:11:26.999813,2025-04-27 16:11:27.173882
112,Crunchbase Pro,Market Research,Commercial,"Crunchbase Pro uses advanced search capabilities and custom list building to help businesses identify key market players and emerging competitors. It provides insights into industry trends, funding history, and key company data to strategize market entry and customer acquisition.",https://www.crunchbase.com/products/crunchbase-pro,"{""market analysis"",""competitive insights"",""investment tracking"",""business intelligence""}",2025-04-27 16:11:26.988273,2025-04-27 16:11:27.249743
412,Dialpad AI Contact Center,AI Contact Center,Commercial,"Dialpad AI Contact Center leverages artificial intelligence to enhance high-volume phone communication tasks. It includes Voice Intelligence technology that transcribes calls, identifies customer sentiments, and assists in qualifying leads during live interactions.",https://www.dialpad.com,"{""voice intelligence"",""call transcription"",""sentiment analysis""}",2025-04-27 16:11:27.265016,2025-04-27 16:11:27.265016
164,Pega,Business Process Management,Commercial,"Pega is a business process management (BPM) tool that uses AI to automate and optimize business processes. It provides a platform for building applications that automate tasks, streamline operations, and improve decision making, thereby enhancing overall process efficiency.",https://www.pega.com/,"{BPM,AI,""process automation"",""decision automation""}",2025-04-27 16:11:27.009488,2025-04-27 16:11:27.009488
166,OpenAI GPT-4,AI Language Model,Commercial,"GPT-4 is an advanced language model developed by OpenAI that can generate human-like text based on the input it receives. It can adapt to new topics and scenarios, making it useful for brainstorming and generating innovative ideas in various domains. It can also be fine-tuned to specific organizational needs, supporting new process implementations by providing insights and automated content generation.",https://www.openai.com/gpt-4,"{AI,""language model"",innovation,adaptability,ideation}",2025-04-27 16:11:27.010186,2025-04-27 16:11:27.010186
168,Microsoft Azure Machine Learning,Machine Learning Platform,Commercial,"Azure Machine Learning is a cloud-based platform for building, training, and deploying machine learning models. It supports adaptability by allowing users to quickly scale and modify models based on new data and changing business requirements. The platform fosters innovation through its extensive toolset that supports various machine learning techniques and integration with other Azure services.",https://azure.microsoft.com/en-us/services/machine-learning/,"{""machine learning"",cloud,AI,adaptability,innovation}",2025-04-27 16:11:27.010878,2025-04-27 16:11:27.010878
169,Google Cloud AutoML,Automated Machine Learning,Commercial,"Google Cloud AutoML enables developers with limited machine learning expertise to train high-quality models specific to their business needs. It adapts to new data inputs and changes in business processes, facilitating the testing and implementation of innovative approaches. AutoML supports various data types and machine learning tasks, enhancing its adaptability and utility in diverse scenarios.",https://cloud.google.com/automl,"{""automated ML"",cloud,AI,adaptability,innovation}",2025-04-27 16:11:27.011188,2025-04-27 16:11:27.011188
172,Outreach Kaia,Sales Engagement,Commercial,"Outreach Kaia is an AI-powered knowledge assistant that captures and shares real-time insights during sales calls. It aids in consultative selling by analyzing conversations to identify customer needs and decision-making criteria, including budget and authority, helping sales reps tailor their discussions and offerings effectively.",https://www.outreach.io/product/kaia,"{AI,""Sales Calls"",""Real-time Insights"",""Consultative Selling"",BANT}",2025-04-27 16:11:27.012175,2025-04-27 16:11:27.012175
193,x.ai,Productivity,Freemium,"x.ai is an AI-powered tool that helps users schedule meetings effortlessly. It integrates with calendars to find the best times for meetings, coordinates with other parties, and automatically handles the booking process.",https://x.ai,"{""AI scheduling"",""meeting coordination"",""calendar integration""}",2025-04-27 16:11:27.019334,2025-04-27 16:11:27.019334
194,Clara,Productivity,Commercial,"Clara is a virtual employee that schedules your meetings, powered by machine learning. It communicates with meeting participants via email to find suitable times and manages the entire scheduling process.",https://claralabs.com,"{""virtual scheduling assistant"",""email coordination"",""AI assistant""}",2025-04-27 16:11:27.019659,2025-04-27 16:11:27.019659
195,Zoom.ai,Communication,Commercial,"Zoom.ai is an automated assistant that helps schedule meetings, with deep integration into multiple calendar platforms. It uses AI to suggest optimal meeting times and can automatically send invites to participants.",https://www.zoom.ai,"{""automated meeting scheduler"",AI-powered,""calendar integration""}",2025-04-27 16:11:27.01997,2025-04-27 16:11:27.01997
196,Cronofy,Productivity,Commercial,Cronofy's Scheduler is a powerful tool that connects to all major calendar services to help find the best times for meetings. It uses AI to analyze availability and preferences to optimize meeting scheduling.,https://www.cronofy.com,"{""calendar API"",""meeting optimization"",""schedule management""}",2025-04-27 16:11:27.020254,2025-04-27 16:11:27.020254
201,Freshsales Freddy AI,CRM and Sales Automation,Commercial,Freddy AI by Freshsales uses artificial intelligence to analyze past lead and sales data to score leads and predict their chances of conversion. It provides insights and recommendations for best next actions to take with each lead.,https://www.freshworks.com/freshsales-crm/,"{AI,CRM,""lead scoring"",""sales predictions""}",2025-04-27 16:11:27.022094,2025-04-27 16:11:27.022094
202,Einstein Analytics,Business Intelligence,Commercial,Einstein Analytics by Salesforce uses AI to enhance sales performance tracking by analyzing sales data and providing predictive insights and prescriptive recommendations. It helps sales teams understand performance trends and make data-driven decisions.,https://www.salesforce.com/products/einstein-analytics/overview/,"{AI,""Sales Performance"",Analytics,""Predictive Insights""}",2025-04-27 16:11:27.022395,2025-04-27 16:11:27.022395
203,Zoho Analytics,Business Intelligence,Freemium,"Zoho Analytics is a self-service BI and data analytics software that uses AI to analyze sales data. It provides features like predictive sales analytics, which help in forecasting future sales and understanding key performance indicators to enhance sales strategies.",https://www.zoho.com/analytics/,"{AI,""Data Analytics"",""Sales Forecasting"",""Performance Tracking""}",2025-04-27 16:11:27.022673,2025-04-27 16:11:27.171869
165,Blue Prism,Robotic Process Automation,Commercial,"Blue Prism is an RPA tool that enables businesses to automate complex and rule-based processes. It uses AI to manage and optimize workflows, helping organizations to achieve greater efficiency and accuracy in their operations.",https://www.blueprism.com/,"{RPA,AI,""workflow management"",""process optimization""}",2025-04-27 16:11:27.009847,2025-04-27 16:11:27.254125
200,Pipedrive LeadBooster,CRM and Sales Automation,Commercial,Pipedrive's LeadBooster is an AI-powered chatbot that pre-qualifies leads directly through website interactions. It asks predefined qualification questions and uses the responses to score and route leads accordingly within the Pipedrive CRM system.,https://www.pipedrive.com/en/features/leadbooster,"{chatbot,""lead management"",CRM,AI}",2025-04-27 16:11:27.021567,2025-04-27 16:11:27.269415
179,Lessonly by Seismic,Corporate Training,Commercial,"Lessonly is a training and coaching platform powered by AI that helps sales teams practice, learn, and improve their sales skills through scenario-based learning and real-time feedback.",https://www.lessonly.com,"{""training platform"",AI,""sales development"",""real-time feedback""}",2025-04-27 16:11:27.01462,2025-04-27 16:11:27.277503
