tool_id,tool_name,description,website_url,license_type,primary_category,tags,created_at,updated_at
105,Zoho Analytics,"Zoho Analytics is a self-service BI and data analytics software that uses AI to analyze sales data. It provides features like predictive sales analytics, which help in forecasting future sales and understanding key performance indicators to enhance sales strategies.",https://www.zoho.com/analytics/,Freemium,Business Intelligence,"[""AI"", ""Data Analytics"", ""Sales Forecasting"", ""Performance Tracking""]",2025-04-25 16:16:26.004676,2025-04-25 16:16:26.004676
106,Tableau CRM,"Tableau CRM (formerly Einstein Analytics) integrates AI to provide advanced analytics and visualizations specifically for CRM data, including sales performance. It offers AI-driven insights and recommendations to optimize sales processes and improve performance metrics.",https://www.tableau.com/products/crm,Commercial,CRM Analytics,"[""AI"", ""CRM"", ""Sales Analytics"", ""Performance Insights""]",2025-04-25 16:16:26.007399,2025-04-25 16:16:26.007399
107,Pipedrive Insights,Pipedrive Insights is a feature within the Pipedrive CRM that utilizes AI to track sales performance and generate detailed reports and dashboards. It helps sales teams visualize their sales pipeline and performance metrics to enhance decision-making.,https://www.pipedrive.com/en/features/insights,Commercial,CRM,"[""Sales Tracking"", ""AI"", ""CRM"", ""Data Visualization""]",2025-04-25 16:16:26.009792,2025-04-25 16:16:26.009792
108,Google Cloud AutoML Natural Language,"Google Cloud AutoML Natural Language uses machine learning to build models capable of analyzing and understanding product information from various data sources such as descriptions, reviews, and support documents. It helps in developing a deep understanding of product features and benefits, which can be used to tailor interactions and solutions for customer needs.",https://cloud.google.com/natural-language/automl/docs,Commercial,Natural Language Processing,"[""NLP"", ""Machine Learning"", ""AutoML"", ""Product Knowledge""]",2025-04-25 16:16:26.016781,2025-04-25 16:16:26.016781
109,Wrike,"Wrike is a versatile project management tool that incorporates AI to help users manage projects from initiation to completion. Its AI features include predictive analytics, which forecasts project timelines and identifies potential bottlenecks, empowering users to proactively manage tasks and take initiative.",https://www.wrike.com,Freemium,Project Management,"[""predictive analytics"", ""project management"", ""AI"", ""task automation""]",2025-04-25 16:16:26.025045,2025-04-25 16:16:26.025045
110,HubSpot Marketing Hub,"HubSpot Marketing Hub uses AI and automation to help marketing teams attract the right visitors, convert more leads, and demonstrate ROI. Its integration with HubSpot CRM and Sales Hub allows for seamless collaboration between sales and marketing teams, ensuring alignment in strategies and communication, which is crucial for enhancing the sales pipeline and driving business growth.",https://www.hubspot.com/products/marketing,Freemium,Marketing Automation,"[""marketing automation"", ""sales alignment"", ""lead management"", ""ROI tracking"", ""CRM""]",2025-04-25 16:16:26.029916,2025-04-25 16:16:26.029916
111,Microsoft Dynamics 365 for Sales,"Microsoft Dynamics 365 for Sales leverages AI to enable smarter selling with contextual AI-driven insights. It facilitates collaboration between sales and marketing teams by integrating with Microsoft's suite of tools including Teams and LinkedIn, which helps in strategizing and executing marketing campaigns that directly impact the sales pipeline.",https://dynamics.microsoft.com/en-us/sales/overview/,Commercial,CRM Software,"[""CRM"", ""AI insights"", ""Microsoft integration"", ""strategic sales"", ""marketing collaboration""]",2025-04-25 16:16:26.034387,2025-04-25 16:16:26.034387
112,Pendo,"Pendo is a product experience platform that uses data-driven insights to help companies educate users about technical products. It features in-app messaging and guides that can be tailored to the user's role and technical expertise, making it easier to communicate complex product functionalities.",https://www.pendo.io,Commercial,Product Management,"[""user onboarding"", ""product experience"", ""data analytics"", ""technical education""]",2025-04-25 16:16:26.040766,2025-04-25 16:16:26.040766
113,WalkMe,WalkMe's digital adoption platform uses AI to provide step-by-step guidance tailored to the user's needs and technical level. It helps businesses communicate the value and functionality of technical products through interactive on-screen walkthroughs.,https://www.walkme.com,Commercial,Digital Adoption,"[""user guidance"", ""interactive walkthroughs"", ""product adoption"", ""technical communication""]",2025-04-25 16:16:26.04305,2025-04-25 16:16:26.04305
114,EdApp,"EdApp is a mobile-first microlearning platform that incorporates AI to deliver personalized learning experiences tailored to individual sales representatives. It includes features such as spaced repetition and smart lessons that adapt based on the learner's performance, effectively helping sales teams master product knowledge.",https://www.edapp.com,Freemium,E-learning,"[""AI learning"", ""microlearning"", ""personalized training"", ""sales training""]",2025-04-25 16:16:26.055845,2025-04-25 16:16:26.055845
115,Docebo,"Docebo is an AI-powered learning platform that offers a suite of tools designed to enhance the training process. It uses artificial intelligence to curate personalized content for learners, optimizing the learning paths according to the needs of sales representatives to become product experts.",https://www.docebo.com,Commercial,E-learning,"[""AI learning platform"", ""content curation"", ""adaptive learning"", ""sales enablement""]",2025-04-25 16:16:26.058457,2025-04-25 16:16:26.058457
116,Allego,"Allego offers a modern sales learning and readiness platform that uses AI to optimize learning retention through personalized content delivery and reinforcement training. The platform is particularly effective for complex product training, helping sales representatives to quickly adapt to market changes and product updates.",https://www.allego.com,Commercial,Sales Training,"[""sales learning"", ""AI-driven"", ""personalized learning"", ""product expertise""]",2025-04-25 16:16:26.063334,2025-04-25 16:16:26.063334
117,Google Cloud Dialogflow,"Dialogflow is a Google Cloud tool for building conversational interfaces for websites, mobile applications, and IoT devices. It can be integrated with a company's product database to train on specific product information, allowing it to conduct informed and accurate discussions about the product's features and benefits with potential clients.",https://cloud.google.com/dialogflow,Freemium,Conversational AI,"[""NLP"", ""chatbot"", ""Google Cloud"", ""AI""]",2025-04-25 16:16:26.078865,2025-04-25 16:16:26.078865
118,Coursera for Business,"Coursera for Business offers a platform where employees can access courses specifically tailored to learning about various industries and products, as well as courses on leadership and career development. This tool helps organizations train their employees to gain a deeper understanding of their products and prepare for career advancements.",https://www.coursera.org/business,Commercial,E-learning,"[""e-learning"", ""career development"", ""product knowledge"", ""online courses""]",2025-04-25 16:16:26.089602,2025-04-25 16:16:26.089602
119,LinkedIn Learning,"LinkedIn Learning provides a wide range of courses that cover product management, market applications, and career development skills. It's integrated within the LinkedIn platform, making it easy for professionals to learn in a context that is directly connected to their career profiles and networks.",https://www.linkedin.com/learning/,Commercial,E-learning,"[""professional development"", ""product knowledge"", ""career skills"", ""online learning""]",2025-04-25 16:16:26.092001,2025-04-25 16:16:26.092001
120,Pluralsight Skills,Pluralsight Skills offers tech-centric content but also includes a variety of courses on product management and market strategies. It's particularly useful for those in tech roles looking to understand the broader market applications of their products and advance their careers within tech-focused companies.,https://www.pluralsight.com/,Commercial,E-learning,"[""technology education"", ""product management"", ""career advancement"", ""skills development""]",2025-04-25 16:16:26.094604,2025-04-25 16:16:26.094604
121,Udemy for Business,Udemy for Business provides a platform with courses on a wide range of topics including product knowledge and career development. Companies can subscribe to allow their employees access to tailored learning paths that help them understand their products better and prepare for future roles.,https://business.udemy.com/,Commercial,E-learning,"[""corporate training"", ""product education"", ""career growth"", ""online courses""]",2025-04-25 16:16:26.097131,2025-04-25 16:16:26.097131
122,Brainshark,"Brainshark offers solutions for sales enablement and readiness, incorporating AI to create dynamic sales training and coaching modules. It supports the acquisition of deep product knowledge and advanced sales skills through engaging multimedia content, analytics, and AI-driven adaptive learning paths.",https://www.brainshark.com,Commercial,Sales Training,"[""sales coaching"", ""multimedia training"", ""adaptive learning"", ""AI""]",2025-04-25 16:16:26.105803,2025-04-25 16:16:26.105803
123,Clerk.io,"Clerk.io uses AI to dynamically present products based on customer behavior and preferences. It integrates with e-commerce platforms to personalize product recommendations and presentations, enhancing customer engagement and sales.",https://www.clerk.io,Commercial,E-commerce Personalization,"[""AI"", ""E-commerce"", ""Personalization"", ""Product Recommendation""]",2025-04-25 16:16:26.10808,2025-04-25 16:16:26.10808
124,Algolia Recommend,Algolia Recommend is an AI-driven tool that provides personalized product recommendations. It uses machine learning algorithms to analyze user interactions and preferences to tailor product presentations on e-commerce sites.,https://www.algolia.com/products/recommend/,Commercial,Search and Discovery,"[""AI"", ""Search Engine"", ""Personalization"", ""Machine Learning""]",2025-04-25 16:16:26.11054,2025-04-25 16:16:26.11054
125,RichRelevance,"RichRelevance offers advanced personalization technologies for retail, utilizing AI to tailor product presentations based on real-time user data and behavior. This enhances the shopping experience by presenting the most relevant products to each customer.",https://www.richrelevance.com,Commercial,Retail Personalization,"[""AI"", ""Retail"", ""Customer Experience"", ""Personalization""]",2025-04-25 16:16:26.113292,2025-04-25 16:16:26.113292
126,Dynamic Yield,"Dynamic Yield employs AI to optimize and personalize product presentations across web, mobile, and email. It analyzes user behavior and preferences to dynamically adjust content and product displays, improving engagement and conversion rates.",https://www.dynamicyield.com,Commercial,Marketing Personalization,"[""AI"", ""Marketing"", ""Personalization"", ""Analytics""]",2025-04-25 16:16:26.11589,2025-04-25 16:16:26.11589
127,Eventbrite Boost,"Eventbrite Boost is an AI-powered marketing platform specifically designed for event promotion and management. It uses machine learning algorithms to optimize advertising across social platforms, predict attendee engagement, and provide insights on how to improve event reach and effectiveness.",https://www.eventbrite.com/l/boost/,Commercial,Event Management,"[""AI Marketing"", ""Event Promotion"", ""Attendee Engagement"", ""Social Media Advertising""]",2025-04-25 16:16:26.118262,2025-04-25 16:16:26.118262
128,Splash,"Splash uses AI to help event organizers design, market, and efficiently manage events. Its AI features include automated marketing workflows and data-driven insights to maximize event exposure and attendee engagement.",https://www.splashthat.com,Commercial,Event Management,"[""Event Design"", ""AI Marketing"", ""Data Insights"", ""Workflow Automation""]",2025-04-25 16:16:26.125136,2025-04-25 16:16:26.125136
129,OptimoRoute,"OptimoRoute uses advanced algorithms and machine learning to optimize routes and schedules for mobile workforces. It is particularly useful for sales representatives as it plans efficient routes and schedules, considering factors like traffic, delivery times, and customer preferences.",https://optimoroute.com,Commercial,Route Optimization,"[""AI"", ""Route Optimization"", ""Itinerary Planning"", ""Sales Efficiency""]",2025-04-25 16:16:26.127813,2025-04-25 16:16:26.127813
130,Route4Me,Route4Me provides dynamic route optimization software designed to use AI to ensure the most efficient routes for its users. It supports all types of routing needs including those of sales professionals managing client visits across different locations. The tool also offers predictive data analytics for better decision-making.,https://www.route4me.com,Freemium,Logistics,"[""Routing"", ""AI"", ""Logistics"", ""Sales Planning"", ""Travel Optimization""]",2025-04-25 16:16:26.130354,2025-04-25 16:16:26.130354
131,Badger Maps,"Badger Maps is a sales routing software that uses AI to analyze traffic data, optimize routes, and manage territories. It helps sales representatives plan their day by visualizing their customers on a map, creating efficient routes, and integrating with their calendar for seamless scheduling.",https://www.badgermapping.com,Commercial,Sales Productivity,"[""Sales Routing"", ""AI"", ""Itinerary Optimization"", ""Client Management""]",2025-04-25 16:16:26.13288,2025-04-25 16:16:26.13288
132,IBM Watson Commerce,"IBM Watson Commerce uses AI to manage inventory levels and optimize pricing. It predicts demand using weather data, market trends, and consumer behavior insights, helping businesses adjust inventory and pricing dynamically.",https://www.ibm.com/products/watson-commerce,Commercial,AI in Commerce,"[""AI"", ""inventory management"", ""dynamic pricing"", ""demand forecasting""]",2025-04-25 16:16:26.160609,2025-04-25 16:16:26.160609
133,LinkSquares,"LinkSquares is an AI-powered contract analytics tool that helps companies analyze contract data to identify opportunities for new partnerships and business growth. It uses natural language processing to extract and interpret key contract terms and conditions, facilitating strategic decision-making.",https://linksquares.com/,Commercial,Legal Tech,"[""AI"", ""Contract Analysis"", ""NLP"", ""Business Growth""]",2025-04-25 16:16:26.201241,2025-04-25 16:16:26.201241
134,Workday Peakon Employee Voice,"Workday Peakon Employee Voice uses real-time analytics and AI to measure employee engagement and provides insights to enhance workplace culture, including sales environments. It offers personalized insights and recommendations to boost morale and recognize achievements, which can be particularly beneficial in maintaining a positive sales culture.",https://www.workday.com/en-us/products/employee-engagement-software/overview.html,Commercial,Employee Engagement,"[""AI"", ""Employee Engagement"", ""Morale Boosting"", ""Sales Culture""]",2025-04-25 16:16:26.220552,2025-04-25 16:16:26.220552
135,Briq,"Briq is a corporate performance management platform that uses AI to automate and enhance recognition programs within sales teams. It helps in setting up personalized rewards and recognition systems that are tailored to the sales culture of an organization, thereby boosting morale and enhancing overall sales performance.",https://www.briq.com/,Commercial,Performance Management,"[""AI"", ""Performance Management"", ""Sales Culture"", ""Recognition""]",2025-04-25 16:16:26.222893,2025-04-25 16:16:26.222893
136,Salesforce Einstein Analytics,"Salesforce Einstein Analytics is an AI-powered analytics tool that provides actionable insights into team performance and customer interactions. It can be used to track and recognize sales achievements, analyze trends in sales team morale, and offer personalized coaching insights, thereby fostering a positive sales culture.",https://www.salesforce.com/products/einstein-analytics/overview/,Commercial,Business Intelligence,"[""AI"", ""Analytics"", ""Sales Culture"", ""Motivational Insights""]",2025-04-25 16:16:26.225423,2025-04-25 16:16:26.225423
137,Mindtickle,"Mindtickle offers a comprehensive sales readiness platform that uses AI to provide sales training modules tailored to the needs of individual sales reps. The platform includes features for role-play, scenario-based training, and real-time feedback to enhance account penetration strategies.",https://www.mindtickle.com,Commercial,Sales Enablement,"[""sales training"", ""AI"", ""account penetration"", ""sales readiness""]",2025-04-25 16:16:26.22813,2025-04-25 16:16:26.22813
138,HireVue,"HireVue leverages AI to enhance the hiring process by providing video interviewing and pre-employment assessment solutions. It uses machine learning algorithms to analyze verbal and non-verbal communication in interviews, helping organizations identify the best candidates who fit their team culture and performance standards.",https://www.hirevue.com,Commercial,Recruitment,"[""AI recruitment"", ""video interviewing"", ""team building"", ""machine learning""]",2025-04-25 16:16:26.243986,2025-04-25 16:16:26.243986
139,Plum,"Plum uses AI to predict how well potential and existing employees will succeed in their roles and fit within a team. By assessing talents through psychometric tests and matching them to job needs, Plum helps in building teams that are aligned with organizational goals and culture.",https://www.plum.io,Commercial,Human Resources,"[""psychometric testing"", ""team development"", ""employee assessment""]",2025-04-25 16:16:26.246833,2025-04-25 16:16:26.246833
140,Pymetrics,Pymetrics applies AI in the form of neuroscience-based games and bias-free algorithms to match candidates’ emotional and cognitive abilities with company profiles. This tool is used for both recruiting new team members and managing workforce development.,https://www.pymetrics.ai,Commercial,Recruitment,"[""neuroscience"", ""workforce development"", ""AI hiring"", ""team building""]",2025-04-25 16:16:26.249501,2025-04-25 16:16:26.249501
141,Culture Amp,"Culture Amp uses AI and analytics to help companies manage and develop their teams. It provides insights into employee engagement and performance, facilitating better decision-making in team development and retention strategies.",https://www.cultureamp.com,Commercial,Employee Engagement,"[""employee engagement"", ""performance management"", ""AI analytics""]",2025-04-25 16:16:26.251817,2025-04-25 16:16:26.251817
142,Eightfold,"Eightfold's Talent Intelligence Platform uses AI to transform recruiting, talent management, and workforce planning. It provides insights and recommendations to manage and develop talent effectively.",https://www.eightfold.ai,Commercial,Talent Management,"[""Talent Intelligence"", ""AI Recruitment"", ""Workforce Planning"", ""Talent Development""]",2025-04-25 16:16:26.258319,2025-04-25 16:16:26.258319
143,Entelo,Entelo applies AI to streamline the recruitment process by automating candidate search and outreach. It uses predictive analytics to identify the best candidates and improve diversity hiring.,https://www.entelo.com,Commercial,Recruitment,"[""Predictive Analytics"", ""Talent Acquisition"", ""Diversity Hiring"", ""Candidate Search""]",2025-04-25 16:16:26.2609,2025-04-25 16:16:26.2609
144,Beamery,Beamery combines elements of CRM and ATS with AI to provide a complete talent acquisition solution. It helps in nurturing candidate relationships and improving the quality of hires.,https://www.beamery.com,Commercial,Talent Acquisition,"[""CRM"", ""ATS"", ""Candidate Relationship"", ""AI Recruitment""]",2025-04-25 16:16:26.263538,2025-04-25 16:16:26.263538
145,Humu,"Humu leverages behavioral science and AI to nudge employees towards better work habits. It analyzes organizational data to deliver personalized nudges to employees, helping to align their behaviors with the company's cultural values and goals.",https://www.humu.com,Commercial,Human Resources,"[""Behavioral Science"", ""AI"", ""Nudges"", ""Organizational Culture""]",2025-04-25 16:16:26.26827,2025-04-25 16:16:26.26827
146,Leapsome,"Leapsome combines tools for performance management, employee engagement, and learning that are powered by AI. It provides frameworks for feedback, goals, and development plans that align with an organization's culture, helping to reinforce and evolve it over time.",https://www.leapsome.com,Commercial,Performance Management,"[""AI"", ""Employee Engagement"", ""Performance Management"", ""Culture Development""]",2025-04-25 16:16:26.270777,2025-04-25 16:16:26.270777
147,Glint,"Glint uses AI to analyze employee survey data to provide insights into organizational health and employee well-being. It helps leaders identify areas of cultural strength and opportunities for development, supporting strategic culture change initiatives.",https://www.glintinc.com,Commercial,Employee Engagement,"[""AI"", ""Surveys"", ""Employee Well-being"", ""Organizational Culture""]",2025-04-25 16:16:26.2731,2025-04-25 16:16:26.2731
148,WorkBoard,"WorkBoard is an AI-powered enterprise platform that helps organizations with strategic planning, alignment, and execution. It enables leaders to define strategic priorities, align teams with these objectives, and use real-time data to adapt strategies as market conditions change.",https://www.workboard.com,Commercial,Business Management,"[""strategic planning"", ""execution"", ""alignment"", ""real-time data"", ""enterprise""]",2025-04-25 16:16:26.275358,2025-04-25 16:16:26.275358
149,ClearPoint Strategy,"ClearPoint Strategy is a strategy management software that integrates management reporting, strategic planning, and execution into one platform. It provides tools for setting and tracking objectives, measuring performance, and adjusting strategies based on analytical insights.",https://www.clearpointstrategy.com,Commercial,Strategy Management,"[""strategy management"", ""reporting"", ""performance measurement"", ""analytics""]",2025-04-25 16:16:26.282323,2025-04-25 16:16:26.282323
150,Replika,"Replika is an AI companion designed to communicate with users in a conversational manner, adapting its responses to improve emotional connection and trust. It uses machine learning to understand and mimic human emotions, making it suitable for building rapport with users.",https://replika.ai,Freemium,AI Chatbot,"[""AI companion"", ""emotional intelligence"", ""chatbot"", ""trust building"", ""rapport""]",2025-04-25 16:16:26.292976,2025-04-25 16:16:26.292976
151,Cognito,"Cognito is designed for customer support and sales teams to enhance their communication skills. It uses AI to analyze voice during calls and provides real-time feedback and guidance on how to better engage and build trust with clients, thereby improving rapport.",https://www.cognitohq.com,Commercial,AI Communication Coach,"[""real-time feedback"", ""voice analysis"", ""customer support"", ""sales enhancement"", ""trust development""]",2025-04-25 16:16:26.295667,2025-04-25 16:16:26.295667
152,Crystal,"Crystal uses AI to analyze public data and personality assessments to provide insights into the best ways to communicate with specific individuals. It helps users tailor their interactions based on personality types, significantly enhancing the ability to build rapport and trust.",https://www.crystalknows.com,Commercial,AI Personality Insights,"[""personality analysis"", ""communication strategies"", ""personalized interaction"", ""rapport building"", ""trust development""]",2025-04-25 16:16:26.298249,2025-04-25 16:16:26.298249
153,Vidyard,"Vidyard is a video platform that allows businesses to create personalized video demonstrations using AI. It can tailor content based on viewer data and engagement, making it suitable for AI-enhanced product demonstrations.",https://www.vidyard.com/,Freemium,Video Marketing,"[""AI Video"", ""Personalization"", ""Marketing"", ""Sales""]",2025-04-25 16:16:26.300527,2025-04-25 16:16:26.300527
154,Smartly.io,"Smartly.io leverages AI to automate and optimize personalized advertising content. It can be used to create dynamic product demonstrations that adapt to the user's behavior and preferences, enhancing the relevance of the demonstration.",https://www.smartly.io/,Commercial,Advertising,"[""AI Advertising"", ""Personalization"", ""Dynamic Content"", ""Marketing Automation""]",2025-04-25 16:16:26.303325,2025-04-25 16:16:26.303325
155,Ceros,"Ceros is an interactive content creation platform that integrates AI to design engaging and personalized digital experiences. It can be used to create interactive product demonstrations that respond to user interactions, providing a tailored demonstration experience.",https://www.ceros.com/,Commercial,Content Creation,"[""Interactive Content"", ""AI Design"", ""Digital Experience"", ""Product Demonstration""]",2025-04-25 16:16:26.305738,2025-04-25 16:16:26.305738
156,Grip,"Grip is an AI-powered event networking tool that uses advanced algorithms to match event participants based on their profiles, interests, and business objectives. It suggests potential connections and conversation starters, enhancing networking opportunities at various events.",https://grip.events,Commercial,Event Networking,"[""AI Networking"", ""Event Management"", ""Professional Networking"", ""AI Matchmaking""]",2025-04-25 16:16:26.307984,2025-04-25 16:16:26.307984
