tool_id,tool_name,description,website_url,license_type,primary_category,tags,created_at,updated_at
157,Brella,"Brella is a networking solution that leverages AI to facilitate connections among event attendees. It analyzes user profiles and preferences to recommend the most relevant people to meet, providing tailored conversation starters to break the ice based on shared interests.",https://www.brella.io,Commercial,Event Networking,"[""Networking"", ""AI Recommendations"", ""Event Planning"", ""Professional Networking""]",2025-04-25 16:16:26.310189,2025-04-25 16:16:26.310189
158,Swapcard,Swapcard utilizes artificial intelligence to enhance networking by analyzing attendee data to predict and recommend the best matches for networking at conferences and trade shows. It also provides conversation starters and tracks the networking success rate to continuously improve its suggestions.,https://www.swapcard.com,Commercial,Event Networking,"[""AI Networking"", ""Event Tech"", ""Matchmaking"", ""Business Networking""]",2025-04-25 16:16:26.312939,2025-04-25 16:16:26.312939
159,Troops,"Troops is a revenue communications platform that uses AI to help sales teams collaborate more effectively. It integrates with CRM systems and messaging platforms to provide automated alerts, data-driven insights, and workflow tools that enhance coordination and decision-making in sales strategies.",https://www.troops.ai/,Commercial,Sales Enablement,"[""AI"", ""Sales Collaboration"", ""CRM Integration"", ""Messaging"", ""Workflow Automation""]",2025-04-25 16:16:26.319813,2025-04-25 16:16:26.319813
160,Qualtrics XM,"Qualtrics XM is an experience management platform that uses AI to analyze feedback from various sources across an organization. It integrates data from marketing, sales, and product teams to provide insights and actionable recommendations for improving messaging and product offerings.",https://www.qualtrics.com,Commercial,Experience Management,"[""feedback analysis"", ""cross-functional"", ""AI-driven"", ""real-time insights""]",2025-04-25 16:16:26.322241,2025-04-25 16:16:26.322241
161,Calendly,"Calendly helps automate the process of scheduling appointments by allowing users to set their availability preferences. It integrates seamlessly with Google, Outlook, Office 365, and iCloud calendars to avoid double-booking and provides automated email and SMS reminders to both parties involved.",https://calendly.com,Freemium,Scheduling,"[""appointment scheduling"", ""calendar integration"", ""automated reminders"", ""time management""]",2025-04-25 16:16:26.328776,2025-04-25 16:16:26.328776
162,Acuity Scheduling,"Acuity Scheduling is a cloud-based appointment scheduling software solution that enables business owners to manage their appointments online. It integrates with various online calendars, supports customized booking forms, and sends automatic confirmations and reminders to clients.",https://acuityscheduling.com,Commercial,Scheduling,"[""online booking"", ""client management"", ""customization"", ""email reminders""]",2025-04-25 16:16:26.331235,2025-04-25 16:16:26.331235
163,Doodle,Doodle simplifies the process of scheduling by allowing users to propose multiple time slots and letting invitees vote on their preferences. It integrates with existing calendar tools to show real-time availability and sends automatic notifications to ensure all participants are informed.,https://doodle.com,Freemium,Scheduling,"[""meeting coordination"", ""polling"", ""calendar sync"", ""group scheduling""]",2025-04-25 16:16:26.333587,2025-04-25 16:16:26.333587
164,10to8,"10to8 is an appointment scheduling software that provides tools for sending automated SMS and email reminders, handling cancellations and reschedules, and syncing with multiple calendars to prevent double bookings. It also features online booking capabilities and reporting tools for businesses.",https://10to8.com,Freemium,Scheduling,"[""SMS reminders"", ""online booking"", ""reporting"", ""client management""]",2025-04-25 16:16:26.335855,2025-04-25 16:16:26.335855
165,Beautiful.AI,"Beautiful.AI is an AI-powered presentation tool that helps users create visually appealing presentations. It uses AI to automatically adjust the layout, design, and flow of slides based on the content entered by the user. This tool simplifies the process of creating professional presentations with minimal design experience.",https://www.beautiful.ai/,Freemium,Presentation Software,"[""AI Presentation"", ""Automatic Design"", ""Slide Management""]",2025-04-25 16:16:26.338208,2025-04-25 16:16:26.338208
166,Visme,Visme is a tool that integrates AI to offer features like automatic data visualization and content suggestions based on the user's presentation goals. It helps in creating engaging and data-driven presentations that can dynamically adjust content to better suit the audience's interests and responses.,https://www.visme.co/,Freemium,Data Visualization,"[""AI-Driven"", ""Dynamic Content"", ""Interactive Presentations""]",2025-04-25 16:16:26.340443,2025-04-25 16:16:26.340443
167,Slidebean,Slidebean uses artificial intelligence to design slides automatically based on the content provided. It features a focus on high-quality design templates and a content adjustment algorithm that optimizes the presentation based on the audience's engagement and feedback.,https://slidebean.com/,Freemium,Presentation Software,"[""AI Design"", ""Content Optimization"", ""Audience Engagement""]",2025-04-25 16:16:26.343048,2025-04-25 16:16:26.343048
168,Zoho Show,"Zoho Show incorporates AI features that assist in crafting presentations with smart elements like real-time co-authoring, automated design suggestions, and audience interaction tools. It enhances the way presentations are created and delivered, making them more interactive and responsive to audience feedback.",https://www.zoho.com/show/,Freemium,Collaborative Software,"[""Collaboration"", ""AI Suggestions"", ""Interactive""]",2025-04-25 16:16:26.346133,2025-04-25 16:16:26.346133
169,Prezi,Prezi uses AI to help users create more dynamic and engaging presentations through its smart structures that adapt based on the presenter's storyline and audience interaction. Prezi's focus is on creating non-linear presentations that maintain audience engagement through zoomable user interfaces.,https://prezi.com/,Freemium,Presentation Software,"[""Dynamic Presentations"", ""Audience Response"", ""Zoomable UI""]",2025-04-25 16:16:26.348823,2025-04-25 16:16:26.348823
170,InsideSales.com,"InsideSales.com offers a sales acceleration platform that uses AI to enhance inside sales management. It features predictive analytics for lead scoring and prioritization, automated dialing, and real-time sales analytics to optimize call scheduling and performance.",https://www.insidesales.com,Commercial,Sales Automation,"[""AI"", ""sales acceleration"", ""lead scoring"", ""real-time analytics"", ""inside sales""]",2025-04-25 16:16:26.357587,2025-04-25 16:16:26.357587
171,ExecVision,"ExecVision analyzes sales calls to derive insights and actionable feedback. It provides a structured environment for sales professionals to learn from their own calls and from others, effectively simulating a mentorship experience with seasoned sales experts.",https://www.execvision.io,Commercial,Sales Performance Management,"[""Sales Call Analysis"", ""Skill Development"", ""AI Insights""]",2025-04-25 16:16:26.370659,2025-04-25 16:16:26.370659
172,Mursion,"Mursion offers a virtual reality environment for professional training, including executive engagement and leadership skills. It uses AI to simulate real-world interactions with avatars that behave like human executives, providing a realistic training environment for users to practice and develop their executive engagement skills.",https://www.mursion.com,Commercial,Virtual Reality Training,"[""VR"", ""leadership training"", ""executive training"", ""AI simulation""]",2025-04-25 16:16:26.372966,2025-04-25 16:16:26.372966
173,Second Nature,"Second Nature uses AI to create a dynamic, interactive training environment where sales professionals can practice their pitches and engage with AI-powered avatars that simulate conversations with executives. This tool helps users refine their approach to corporate selling strategies and executive interaction.",https://www.secondnature.ai,Commercial,AI Sales Training,"[""sales training"", ""AI coaching"", ""executive engagement"", ""interactive learning""]",2025-04-25 16:16:26.375233,2025-04-25 16:16:26.375233
174,Matterhorn,"Matterhorn provides scenario-based training modules tailored for executive engagement, utilizing AI to adapt scenarios and feedback based on the user's performance. This platform is designed to enhance users' skills in navigating complex corporate strategies and engaging effectively with senior leadership.",https://www.matterhorn.io,Commercial,Online Learning Platform,"[""e-learning"", ""executive training"", ""scenario-based training"", ""AI feedback""]",2025-04-25 16:16:26.377644,2025-04-25 16:16:26.377644
175,PitchBook,"PitchBook provides comprehensive data on the global M&A, private equity, and venture capital markets, including detailed coverage of the cybersecurity sector. It helps in analyzing market trends, identifying key players, and understanding investment patterns.",https://www.pitchbook.com,Commercial,Financial Analysis,"[""financial data"", ""cybersecurity investments"", ""market analysis"", ""venture capital""]",2025-04-25 16:16:26.386385,2025-04-25 16:16:26.386385
176,Marketo,"Marketo, an Adobe company, uses AI and machine learning to automate and optimize marketing tasks and workflows. It helps in developing go-to-market strategies by providing tools for customer segmentation, campaign management, and performance analytics to ensure effective market penetration.",https://www.marketo.com/,Commercial,Marketing Automation,"[""marketing automation"", ""customer segmentation"", ""campaign management""]",2025-04-25 16:16:26.392719,2025-04-25 16:16:26.392719
177,SimilarWeb,"SimilarWeb provides analytics on web traffic and market engagement. This tool helps companies understand where their competitors are gaining traction and which markets are most lucrative. It offers insights into customer behavior and industry trends, aiding in strategic planning and product positioning.",https://www.similarweb.com,Commercial,Web Analytics,"[""traffic analytics"", ""market research"", ""behavior analysis""]",2025-04-25 16:16:26.412807,2025-04-25 16:16:26.412807
178,Five9 Intelligent Cloud Contact Center,"Five9 Intelligent Cloud Contact Center uses AI to manage high-volume phone communications effectively. It automates the dialing process, connects with prospects, and uses AI to qualify leads based on interaction analytics and predefined criteria.",https://www.five9.com,Commercial,AI Contact Center,"[""AI dialing"", ""lead qualification"", ""cloud contact center""]",2025-04-25 16:16:26.535641,2025-04-25 16:16:26.535641
179,Talkdesk,"Talkdesk offers an AI-powered contact center solution that excels in handling high volumes of phone calls. It features automated dialing, intelligent routing to connect prospects with the most appropriate agent, and AI-driven insights for lead qualification.",https://www.talkdesk.com,Commercial,AI Contact Center,"[""automated dialing"", ""AI routing"", ""sales calls""]",2025-04-25 16:16:26.538223,2025-04-25 16:16:26.538223
180,Dialpad AI Contact Center,"Dialpad AI Contact Center leverages artificial intelligence to enhance high-volume phone communication tasks. It includes Voice Intelligence technology that transcribes calls, identifies customer sentiments, and assists in qualifying leads during live interactions.",https://www.dialpad.com,Commercial,AI Contact Center,"[""voice intelligence"", ""call transcription"", ""sentiment analysis""]",2025-04-25 16:16:26.54061,2025-04-25 16:16:26.54061
181,Aircall,"Aircall is a cloud-based phone system and call center software that integrates AI to manage high call volumes efficiently. It provides features like power dialer, call queuing, and real-time analytics to streamline sales calls and lead management.",https://www.aircall.io,Commercial,AI Contact Center,"[""power dialer"", ""call analytics"", ""cloud-based telephony""]",2025-04-25 16:16:26.542888,2025-04-25 16:16:26.542888
182,Exceed.ai,"Exceed.ai is an AI-powered sales assistant that automates lead qualification and follow-up. It engages with leads via email and chat, assesses their interest and suitability, and schedules product demonstrations or sales calls directly on the sales team's calendar.",https://www.exceed.ai,Commercial,Sales Automation,"[""AI Sales Assistant"", ""Lead Qualification"", ""Demo Scheduling"", ""Email Automation"", ""Chatbot""]",2025-04-25 16:16:26.545646,2025-04-25 16:16:26.545646
183,Conversica,"Conversica provides an AI-driven automated sales assistant that reaches out to leads with natural language emails or messages. It engages in conversations to determine lead interest and readiness, and can autonomously set up demos or meetings with sales representatives.",https://www.conversica.com,Commercial,Customer Relationship Management,"[""AI Assistant"", ""Lead Engagement"", ""Automated Conversations"", ""Sales Enablement""]",2025-04-25 16:16:26.548243,2025-04-25 16:16:26.548243
184,Dialpad Sell,"Dialpad Sell offers AI-powered sales dialer solutions that automate the cold calling process. It features Voice Intelligence technology that provides real-time coaching and feedback during calls, helping sales teams to improve their pitch and close rates.",https://www.dialpad.com/sell/,Commercial,Sales Automation,"[""AI"", ""sales automation"", ""voice intelligence"", ""real-time coaching""]",2025-04-25 16:16:26.555092,2025-04-25 16:16:26.555092
185,Beautiful.ai,"Beautiful.ai is an AI-powered presentation tool that assists in designing visually appealing sales presentations. While it primarily focuses on design, it can integrate with other AI tools to adapt content dynamically and provide data-driven insights during presentations.",https://www.beautiful.ai,Freemium,Presentation Software,"[""Presentation Design"", ""AI Design Assistance"", ""Sales Presentations"", ""Interactive Presentations""]",2025-04-25 16:16:26.594831,2025-04-25 16:16:26.594831
186,Crunchbase,"Crunchbase provides comprehensive data on startups, venture capital firms, and other business entities. It uses AI to analyze market trends, investment patterns, and industry movements, helping businesses stay informed about the latest developments in their respective fields.",https://www.crunchbase.com,Freemium,Market Intelligence,"[""industry trends"", ""investment tracking"", ""startup insights""]",2025-04-25 16:16:26.606269,2025-04-25 16:16:26.606269
187,Trend Hunter AI,Trend Hunter AI utilizes advanced algorithms to identify and analyze emerging trends across various industries. This tool helps businesses anticipate market shifts and innovate new products or services.,https://www.trendhunter.com,Commercial,Trend Analysis,"[""trend spotting"", ""innovation"", ""market foresight""]",2025-04-25 16:16:26.612888,2025-04-25 16:16:26.612888
188,InsightSquared,"InsightSquared offers AI-driven sales analytics and performance management solutions that analyze various sales metrics, including pipeline growth and quota attainment. It provides detailed forecasts and insights, helping sales leaders make informed decisions.",https://www.insightsquared.com/,Commercial,Business Intelligence,"[""sales analytics"", ""business intelligence"", ""performance tracking""]",2025-04-25 16:16:26.62151,2025-04-25 16:16:26.62151
189,People.ai,People.ai utilizes AI to optimize sales operations by analyzing the effectiveness of face-to-face customer interactions. It automates the capture of sales activity to provide real-time insights into performance and helps in scheduling and training of sales personnel.,https://www.people.ai,Commercial,Sales Performance Management,"[""AI"", ""sales optimization"", ""activity tracking"", ""training""]",2025-04-25 16:16:26.628262,2025-04-25 16:16:26.628262
190,Five9 Predictive Dialer,Five9 Predictive Dialer uses AI to increase the efficiency of call centers by predicting the best times to call customers and automating the dialing process. It helps in managing high volumes of calls by minimizing idle time and ensuring agents are connected as soon as a call is answered.,https://www.five9.com/products/predictive-dialer,Commercial,Call Center Automation,"[""predictive dialer"", ""call automation"", ""AI dialing"", ""high-volume calling""]",2025-04-25 16:16:26.643219,2025-04-25 16:16:26.643219
191,NICE CXone,"NICE CXone is a cloud customer experience platform that includes an Automated Dialer which uses advanced algorithms to manage high volumes of calls efficiently. It optimizes call schedules and automates the dialing process, improving operational efficiency and agent productivity.",https://www.nice.com/websites/cxone/,Commercial,Customer Experience Management,"[""automated dialer"", ""customer experience"", ""call management"", ""AI""]",2025-04-25 16:16:26.645907,2025-04-25 16:16:26.645907
192,Aspect Via,"Aspect Via offers a comprehensive call management solution that includes a high-volume automated dialing system. It leverages AI to optimize call schedules and automate the dialing processes, which helps in managing large scale outbound call activities efficiently.",https://www.aspect.com/solutions/call-center-solutions/aspect-via-platform,Commercial,Call Center Solutions,"[""automated dialing"", ""call center"", ""high-volume management"", ""AI""]",2025-04-25 16:16:26.648158,2025-04-25 16:16:26.648158
193,Ambition,"Ambition is a sales management platform that syncs with CRM systems to provide real-time performance tracking, gamification, and coaching insights. It enhances sales team accountability and motivation by turning productivity data into engaging, competitive leaderboards and scorecards.",https://ambition.com,Commercial,Sales Performance Management,"[""sales gamification"", ""performance tracking"", ""real-time feedback"", ""CRM integration""]",2025-04-25 16:16:26.650413,2025-04-25 16:16:26.650413
194,Hoopla,"Hoopla is a team performance software that leverages gamification techniques to drive engagement and enhance performance among sales teams. It offers features like leaderboards, contests, and real-time recognition, all designed to boost team spirit and accountability.",https://www.hoopla.net,Commercial,Employee Engagement,"[""gamification"", ""sales performance"", ""team motivation"", ""real-time updates""]",2025-04-25 16:16:26.652879,2025-04-25 16:16:26.652879
195,Spinify,Spinify is a leader in leaderboard software for boosting team performance. It uses gamification to increase sales team engagement and accountability by displaying real-time performance metrics and personalized motivators.,https://www.spinify.com,Commercial,Gamification,"[""leaderboards"", ""sales gamification"", ""performance management"", ""real-time feedback""]",2025-04-25 16:16:26.655142,2025-04-25 16:16:26.655142
196,LevelEleven,"LevelEleven is a performance management tool that focuses on real-time feedback and gamification to enhance sales team performance. It integrates with Salesforce to provide personalized scorecards, contests, and performance metrics that drive accountability and results.",https://leveleleven.com,Commercial,Sales Performance Management,"[""salesforce integration"", ""performance metrics"", ""gamification"", ""real-time feedback""]",2025-04-25 16:16:26.657384,2025-04-25 16:16:26.657384
197,Chili Piper,Chili Piper specializes in scheduling automation for high-priority sales meetings. It integrates directly with CRM systems to pull in prospect priority data and uses intelligent algorithms to schedule meetings at optimal times for both sales teams and prospects.,https://www.chilipiper.com,Commercial,Sales Automation,"[""sales automation"", ""CRM integration"", ""meeting scheduling"", ""lead management""]",2025-04-25 16:16:26.666018,2025-04-25 16:16:26.666018
198,Crimson Hexagon,"Crimson Hexagon is an AI-powered consumer insights platform that uses advanced algorithms to analyze market trends and consumer sentiment from various data sources, including social media. It helps sales teams understand market dynamics and emerging trends to make informed decisions.",https://www.crimsonhexagon.com,Commercial,Market Intelligence,"[""market trend analysis"", ""consumer insights"", ""AI"", ""data analysis""]",2025-04-25 16:16:26.668365,2025-04-25 16:16:26.668365
199,Talkwalker,"Talkwalker uses AI and machine learning to analyze online, social, and print media data to identify market trends and brand health. It provides real-time analytics that helps sales teams to track market movements and consumer opinions.",https://www.talkwalker.com,Commercial,Social Media Monitoring,"[""social media analysis"", ""market trends"", ""brand monitoring"", ""AI""]",2025-04-25 16:16:26.670767,2025-04-25 16:16:26.670767
200,Brandwatch,"Brandwatch is a digital consumer intelligence platform that uses AI to analyze data across the web, social media, and proprietary data sources. It helps in identifying market trends, consumer sentiment, and competitive analysis, providing comprehensive insights to sales and marketing teams.",https://www.brandwatch.com,Commercial,Consumer Research,"[""market analysis"", ""consumer behavior"", ""AI"", ""trend analysis""]",2025-04-25 16:16:26.673041,2025-04-25 16:16:26.673041
201,Sprout Social,"Sprout Social offers social media management and analytics tools that leverage AI to provide detailed reports on social media trends, engagement, and audience growth. This assists sales teams in understanding market trends and developing strategies based on real-time data.",https://www.sproutsocial.com,Commercial,Social Media Analytics,"[""social media"", ""analytics"", ""AI"", ""market trends""]",2025-04-25 16:16:26.675282,2025-04-25 16:16:26.675282
