tool_id,tool_name,description,website_url,license_type,primary_category,tags,created_at,updated_at
1,Google Cloud Natural Language API,"Google Cloud Natural Language API uses machine learning to understand text and extract information about people, places, and events. It provides features like sentiment analysis, entity analysis, and syntax analysis, enabling applications to understand the context and meaning of text.",https://cloud.google.com/natural-language,Commercial,NLP,"[""NLP"", ""machine learning"", ""text analysis"", ""Google Cloud""]",2025-04-25 16:16:25.41386,2025-04-25 16:16:25.41386
2,IBM Watson Natural Language Understanding,"IBM Watson Natural Language Understanding is a cloud-native product that uses deep learning to analyze text for concepts, entities, keywords, categories, sentiment, emotion, and more. It helps businesses to understand complex text and make better data-driven decisions.",https://www.ibm.com/cloud/watson-natural-language-understanding,Commercial,NLP,"[""NLP"", ""IBM Watson"", ""text analytics"", ""sentiment analysis""]",2025-04-25 16:16:25.426463,2025-04-25 16:16:25.426463
3,spaCy,"spaCy is an open-source software library for advanced natural language processing, designed specifically for production use. It supports over 60 languages and offers features like tokenization, named entity recognition, part of speech tagging, and dependency parsing.",https://spacy.io,Open Source,NLP,"[""NLP"", ""open source"", ""text processing"", ""language models""]",2025-04-25 16:16:25.432167,2025-04-25 16:16:25.432167
4,OpenAI GPT-3,"GPT-3, developed by OpenAI, is one of the most powerful language processing AI models available. It excels in understanding and generating human-like text, enabling applications to perform tasks like translation, summarization, and question answering.",https://openai.com/gpt-3,Commercial,NLP,"[""NLP"", ""OpenAI"", ""language model"", ""text generation""]",2025-04-25 16:16:25.437739,2025-04-25 16:16:25.437739
5,Hugging Face Transformers,"Transformers library by Hugging Face provides state-of-the-art general-purpose architectures for natural language understanding and generation. It includes thousands of pre-trained models, including models for text response generation like BERT, GPT-2, and RoBERTa, which can be fine-tuned for specific tasks.",https://huggingface.co/transformers,Open Source,NLP,"[""AI"", ""NLP"", ""machine learning"", ""Hugging Face"", ""Transformers"", ""text generation""]",2025-04-25 16:16:25.448468,2025-04-25 16:16:25.448468
6,IBM Watson Assistant,"IBM Watson Assistant is a conversational AI platform designed to generate human-like text responses in various applications, such as customer service bots. It uses natural language understanding and machine learning to interpret user inputs and generate relevant responses.",https://www.ibm.com/cloud/watson-assistant,Commercial,NLP,"[""AI"", ""NLP"", ""IBM Watson"", ""chatbot"", ""customer service""]",2025-04-25 16:16:25.485764,2025-04-25 16:16:25.485764
7,Google Cloud Natural Language AI,"Google Cloud Natural Language AI provides a suite of language understanding technologies, including an API that can be used for generating text responses. It leverages Google's machine learning technology to understand and generate human-like text for a variety of applications.",https://cloud.google.com/natural-language,Commercial,NLP,"[""AI"", ""NLP"", ""Google Cloud"", ""text generation"", ""machine learning""]",2025-04-25 16:16:25.498752,2025-04-25 16:16:25.498752
8,Elasticsearch,"Elasticsearch is a distributed, RESTful search and analytics engine capable of addressing a large number of use cases, including knowledge base integration. It allows users to store, search, and analyze big volumes of data quickly and in near real time. Elasticsearch is commonly used to enable search capabilities over documents and content within a knowledge base.",https://www.elastic.co/elasticsearch/,Open Source,Search Engine,"[""search engine"", ""analytics"", ""big data"", ""real-time""]",2025-04-25 16:16:25.504825,2025-04-25 16:16:25.504825
9,Algolia,"Algolia provides a hosted search API that enables developers to integrate search functionality into their applications and knowledge bases. It offers a powerful, fast, and scalable search experience with features like typo tolerance, filters, and synonyms that enhance the retrieval of information from knowledge repositories.",https://www.algolia.com/,Freemium,Search API,"[""hosted API"", ""search"", ""scalable"", ""typo tolerance""]",2025-04-25 16:16:25.510543,2025-04-25 16:16:25.510543
10,Apache Solr,"Apache Solr is an open-source search platform built on Apache Lucene. It is highly reliable, scalable, and fault tolerant, providing distributed indexing, replication, and load-balanced querying with a centralized configuration. Solr is widely used for enterprise search and analytics use cases, including integrating with knowledge bases to facilitate information retrieval.",https://solr.apache.org/,Open Source,Search Platform,"[""enterprise search"", ""indexing"", ""Apache Lucene"", ""scalable""]",2025-04-25 16:16:25.516246,2025-04-25 16:16:25.516246
11,Microsoft Azure Cognitive Search,"Azure Cognitive Search is a cloud search service with built-in AI capabilities that enrich all types of information to easily identify and explore relevant content at scale. It supports integration with knowledge bases, providing capabilities such as natural language processing, AI-powered insights, and complex search queries over structured and unstructured data.",https://azure.microsoft.com/en-us/services/search/,Commercial,Cloud Search Service,"[""cloud service"", ""AI capabilities"", ""NLP"", ""data insights""]",2025-04-25 16:16:25.521408,2025-04-25 16:16:25.521408
12,RFPIO,RFPIO is a response management platform that uses AI to help streamline the process of responding to RFPs (Request for Proposals). It features advanced capabilities to automatically extract questions from RFP documents and uses a content library to generate accurate and relevant draft responses. This helps organizations save time and improve the quality of their proposal submissions.,https://www.rfpio.com,Commercial,Document Processing,"[""RFP"", ""automation"", ""document processing"", ""AI"", ""proposal management""]",2025-04-25 16:16:25.526035,2025-04-25 16:16:25.526035
13,Loopio,"Loopio is a platform designed to help businesses manage RFP responses more efficiently. It leverages machine learning to automatically extract questions from RFPs and populate answers using a pre-built library. Loopio also facilitates collaboration among team members, making it easier to craft tailored responses to complex RFPs.",https://www.loopio.com,Commercial,Document Processing,"[""RFP"", ""response automation"", ""collaboration"", ""machine learning""]",2025-04-25 16:16:25.541738,2025-04-25 16:16:25.541738
14,Qvidian,"Qvidian by Upland Software offers automated RFP and proposal generation tools that help organizations increase efficiency in their sales cycles. The tool uses AI to analyze RFP documents, extract pertinent questions, and assist in creating detailed, customized responses based on a centralized content database.",https://uplandsoftware.com/qvidian/,Commercial,Document Processing,"[""RFP"", ""proposal automation"", ""sales enablement"", ""content management""]",2025-04-25 16:16:25.546978,2025-04-25 16:16:25.546978
15,Tableau,"Tableau is a powerful data visualization tool that allows users to create interactive and shareable dashboards. It helps in analyzing sales data by providing features like trend analysis, forecasting, and segmentation, which can be used to identify patterns and opportunities in sales data.",https://www.tableau.com,Commercial,Data Visualization,"[""data visualization"", ""sales analysis"", ""trend analysis"", ""forecasting""]",2025-04-25 16:16:25.551657,2025-04-25 16:16:25.551657
81,Seismic,Seismic is a sales enablement platform that leverages AI to personalize sales materials and automate the preparation process. It ensures that sales teams are equipped with the right information and strategies throughout the sales cycle.,https://www.seismic.com,Commercial,Sales Enablement,"[""Sales Content Management"", ""AI"", ""Personalization"", ""Sales Automation""]",2025-04-25 16:16:25.845396,2025-04-25 16:16:25.845396
16,Microsoft Power BI,"Microsoft Power BI is a suite of business analytics tools that deliver insights throughout your organization. It enables users to connect to hundreds of data sources, simplify data prep, and drive ad hoc analysis for sales data. Power BI provides robust analytics and reporting features to help identify trends and opportunities in sales.",https://powerbi.microsoft.com,Freemium,Business Intelligence,"[""business intelligence"", ""data analysis"", ""reporting"", ""sales data""]",2025-04-25 16:16:25.555055,2025-04-25 16:16:25.555055
17,Looker,"Looker is a business intelligence software and big data analytics platform that helps you explore, analyze and share real-time business analytics easily. It facilitates the analysis of sales data through its robust data modeling and visualization capabilities, helping businesses uncover trends and make data-driven decisions.",https://looker.com,Commercial,Business Intelligence,"[""business intelligence"", ""data analytics"", ""visualization"", ""sales trends""]",2025-04-25 16:16:25.558406,2025-04-25 16:16:25.558406
18,Sisense,Sisense empowers analysts and business users to simplify complex data and provide insights using powerful dashboarding and data analytics tools. It supports sales data analysis by allowing users to merge data from different sources and visualize data to identify trends and generate actionable insights.,https://www.sisense.com,Commercial,Business Intelligence,"[""data integration"", ""analytics"", ""dashboard"", ""sales insights""]",2025-04-25 16:16:25.561255,2025-04-25 16:16:25.561255
19,Qlik Sense,"Qlik Sense is a self-service data analytics and visualization tool that uses an associative analytics engine, sophisticated AI, and high performance cloud platform to help users make data-driven decisions. It is particularly effective in analyzing sales data, offering dynamic visualizations and interactive dashboards for spotting trends and opportunities.",https://www.qlik.com,Commercial,Data Visualization,"[""data visualization"", ""self-service analytics"", ""AI"", ""sales data analysis""]",2025-04-25 16:16:25.564006,2025-04-25 16:16:25.564006
20,Jasper,"Jasper is an AI-powered content generation tool that helps users create high-quality content for blogs, social media, websites, and more. It uses machine learning to understand context and generate relevant and engaging content.",https://www.jasper.ai,Commercial,Content Creation,"[""content marketing"", ""AI writer"", ""blogging tool"", ""content automation""]",2025-04-25 16:16:25.570417,2025-04-25 16:16:25.570417
21,Writesonic,"Writesonic is an AI tool designed to help with marketing content creation, including ads, emails, and blog posts. It uses artificial intelligence to generate creative and compelling text that captures attention and engages readers.",https://writesonic.com,Freemium,Content Creation,"[""digital marketing"", ""AI content generator"", ""copywriting tool"", ""content creation""]",2025-04-25 16:16:25.573426,2025-04-25 16:16:25.573426
22,CopyAI,"CopyAI is an automated copywriting tool that uses AI to help users generate marketing copy instantly. It's designed to produce various types of content such as social media posts, blog posts, and email newsletters.",https://www.copy.ai,Freemium,Content Creation,"[""AI copywriting"", ""content generation"", ""marketing tool"", ""AI marketing""]",2025-04-25 16:16:25.576304,2025-04-25 16:16:25.576304
23,Clari,"Clari uses AI to enhance visibility into the sales process, helping sales teams to forecast and manage quotas more effectively. It provides real-time insights into sales performance and predictive analytics to guide sales strategies, ensuring quota achievement.",https://www.clari.com/,Commercial,Sales Performance Management,"[""AI"", ""Sales Forecasting"", ""Quota Management"", ""Predictive Analytics""]",2025-04-25 16:16:25.579539,2025-04-25 16:16:25.579539
24,Xactly,"Xactly offers a comprehensive suite of AI-driven sales performance management tools that help in setting, tracking, and analyzing sales quotas. It uses data-driven insights to optimize sales strategies and improve quota attainment.",https://www.xactlycorp.com/,Commercial,Sales Performance Management,"[""Sales Management"", ""Performance Tracking"", ""AI"", ""Quota Achievement""]",2025-04-25 16:16:25.582311,2025-04-25 16:16:25.582311
25,Anaplan,"Anaplan's Connected Planning platform leverages AI to help sales teams manage and achieve their quotas. It provides tools for sales planning, forecasting, and scenario analysis, which help in making informed decisions to meet sales targets.",https://www.anaplan.com/,Commercial,Business Planning,"[""Sales Planning"", ""AI"", ""Forecasting"", ""Quota Management""]",2025-04-25 16:16:25.584811,2025-04-25 16:16:25.584811
26,Persado,Persado uses AI to generate persuasive language for communications tailored to audience segments. This tool leverages natural language processing and machine learning to craft messages that effectively communicate the value propositions of products or services to different customer profiles.,https://www.persado.com,Commercial,Marketing Automation,"[""AI Marketing"", ""NLP"", ""Machine Learning"", ""Value Proposition"", ""Customer Engagement""]",2025-04-25 16:16:25.588907,2025-04-25 16:16:25.588907
27,Phrasee,"Phrasee uses AI to power its language generation for marketing copy, focusing on creating brand-consistent, engaging content that communicates a product’s value proposition effectively. It analyzes existing marketing language and audience reactions to tailor messages that resonate with specific customer segments.",https://www.phrasee.co,Commercial,Content Generation,"[""Content Marketing"", ""AI Writing"", ""Email Marketing"", ""Personalization"", ""Value Communication""]",2025-04-25 16:16:25.591895,2025-04-25 16:16:25.591895
28,Copy.ai,"Copy.ai is an AI-powered tool that assists in generating marketing copy, including value propositions. It uses advanced algorithms to understand the product features and benefits, tailoring the communication to meet the specific needs of the target audience.",https://www.copy.ai,Freemium,AI Writing Assistant,"[""Copywriting"", ""AI Tool"", ""Marketing"", ""Value Proposition"", ""Automation""]",2025-04-25 16:16:25.594525,2025-04-25 16:16:25.594525
29,Salesforce Einstein,"Salesforce Einstein is an AI layer integrated within the Salesforce platform that enhances CRM capabilities by providing AI-driven insights, predictions, and recommendations. It helps sales leaders by analyzing customer data to offer guidance on the most effective sales strategies and personalizing customer interactions to drive sales.",https://www.salesforce.com/products/einstein/overview/,Commercial,CRM AI,"[""AI"", ""CRM"", ""sales automation"", ""customer insights"", ""sales leadership""]",2025-04-25 16:16:25.597665,2025-04-25 16:16:25.597665
30,Outreach,"Outreach is a sales engagement platform that leverages AI to optimize customer interactions. It assists sales leaders by automating routine tasks, providing actionable insights, and enabling personalized communication strategies that can influence sales outcomes.",https://www.outreach.io/,Commercial,Sales Engagement,"[""sales automation"", ""AI"", ""customer engagement"", ""sales productivity""]",2025-04-25 16:16:25.602781,2025-04-25 16:16:25.602781
31,Drift,"Drift is an AI-powered conversational marketing platform that engages with potential customers at the early stages of the sales cycle. It provides personalized chatbot interactions that can demonstrate products, answer queries, and guide users through initial sales processes, effectively enhancing client understanding and engagement.",https://www.drift.com,Commercial,Conversational AI,"[""AI chatbot"", ""sales support"", ""customer engagement"", ""conversational marketing""]",2025-04-25 16:16:25.605447,2025-04-25 16:16:25.605447
98,x.ai,"x.ai is an AI-powered tool that helps users schedule meetings effortlessly. It integrates with calendars to find the best times for meetings, coordinates with other parties, and automatically handles the booking process.",https://x.ai,Freemium,Productivity,"[""AI scheduling"", ""meeting coordination"", ""calendar integration""]",2025-04-25 16:16:25.979133,2025-04-25 16:16:25.979133
32,Salesforce Sales Cloud,"Salesforce Sales Cloud provides advanced AI capabilities through its Einstein AI platform, which includes features for collaborative territory management. It allows sales teams to plan and optimize territories based on historical data and predictive analytics, enhancing collaboration and strategic decision-making.",https://www.salesforce.com/products/sales-cloud/overview/,Commercial,CRM,"[""collaborative territory management"", ""sales optimization"", ""predictive analytics"", ""CRM""]",2025-04-25 16:16:25.612583,2025-04-25 16:16:25.612583
33,Zoho CRM,"Zoho CRM offers territory management that helps businesses design and manage multiple territories by analyzing sales performance and potential. It features collaborative tools that enable teams to work together in real-time, ensuring efficient territory alignment and maximizing sales opportunities.",https://www.zoho.com/crm/,Freemium,CRM,"[""territory management"", ""real-time collaboration"", ""sales analytics"", ""CRM""]",2025-04-25 16:16:25.6152,2025-04-25 16:16:25.6152
34,Microsoft Dynamics 365 Sales,"Microsoft Dynamics 365 Sales integrates AI-driven insights to facilitate collaborative territory management. It helps in defining and managing territories, using AI to forecast sales and identify high-potential accounts within those territories. The platform supports collaboration across teams, ensuring aligned goals and strategies.",https://dynamics.microsoft.com/en-us/sales/overview/,Commercial,CRM,"[""AI insights"", ""territory management"", ""forecasting"", ""collaboration""]",2025-04-25 16:16:25.617628,2025-04-25 16:16:25.617628
35,Crayon,"Crayon provides a competitive intelligence platform that enables businesses to track, analyze, and act on everything happening outside their four walls. Its features include capturing and analyzing competitor data which can be used to highlight a product's competitive advantages in demonstrations.",https://www.crayon.co,Commercial,Competitive Intelligence,"[""competitive analysis"", ""market intelligence"", ""product demonstration""]",2025-04-25 16:16:25.620307,2025-04-25 16:16:25.620307
36,Kompyte,Kompyte helps companies track their competitors in real-time and automatically reacts to their moves. It provides insights and analytics that can be used to demonstrate a product's superiority over competitors during sales pitches and marketing campaigns.,https://www.kompyte.com,Commercial,Competitive Intelligence,"[""real-time tracking"", ""competitive analysis"", ""sales enablement""]",2025-04-25 16:16:25.623109,2025-04-25 16:16:25.623109
37,Prisync,"Prisync is a competitor price tracking and monitoring software for all sizes of e-commerce companies worldwide. It helps businesses to demonstrate competitive pricing strategies by providing detailed comparisons and analytics, which can be used to highlight cost advantages in product demonstrations.",https://www.prisync.com,Commercial,Pricing Intelligence,"[""price tracking"", ""e-commerce"", ""competitive pricing""]",2025-04-25 16:16:25.625572,2025-04-25 16:16:25.625572
38,Owler,"Owler offers news alerts, company profiles, and polls about competitors, which can be leveraged to understand and demonstrate a product's unique position and advantages in the market.",https://www.owler.com,Freemium,Business Intelligence,"[""company news"", ""competitive insights"", ""market trends""]",2025-04-25 16:16:25.628665,2025-04-25 16:16:25.628665
39,Slack,Slack is a messaging app for teams that makes it easy for sales teams to communicate with technical departments in real-time. It supports integration with various AI and automation tools to streamline workflows and enhance collaboration.,https://slack.com,Freemium,Communication,"[""messaging"", ""collaboration"", ""real-time"", ""integration"", ""sales"", ""technical""]",2025-04-25 16:16:25.631284,2025-04-25 16:16:25.631284
40,Trello,"Trello is a web-based Kanban-style list-making application which is great for managing projects across sales and technical teams. It allows users to create tasks, assign them to team members, and track progress collaboratively.",https://trello.com,Freemium,Project Management,"[""project management"", ""kanban"", ""task management"", ""collaboration"", ""sales"", ""technical""]",2025-04-25 16:16:25.633862,2025-04-25 16:16:25.633862
41,Microsoft Teams,"Microsoft Teams is a unified communication and collaboration platform that combines persistent workplace chat, video meetings, file storage, and application integration. It is designed to help teams collaborate more effectively, and integrates with various sales and technical tools.",https://teams.microsoft.com,Commercial,Communication,"[""communication"", ""collaboration"", ""meetings"", ""chat"", ""sales"", ""technical""]",2025-04-25 16:16:25.636241,2025-04-25 16:16:25.636241
42,Asana,"Asana is a project management tool that helps teams organize, track, and manage their work. It's particularly useful for sales and technical teams to collaborate on projects, with features that facilitate task assignments, deadlines, and updates.",https://asana.com,Freemium,Project Management,"[""project management"", ""task tracking"", ""collaboration"", ""sales"", ""technical""]",2025-04-25 16:16:25.638668,2025-04-25 16:16:25.638668
43,HubSpot Sales Hub,HubSpot Sales Hub utilizes machine learning to provide sales teams with insights into the most effective sales strategies and customer engagement techniques. It adapts recommendations based on ongoing sales data and market conditions.,https://www.hubspot.com/products/sales,Freemium,Sales Automation,"[""sales automation"", ""AI"", ""machine learning"", ""dynamic sales strategy""]",2025-04-25 16:16:25.646024,2025-04-25 16:16:25.646024
44,Gong.io,Gong.io uses AI to analyze communication data within sales teams to provide insights into customer interactions and sales processes. It helps sales professionals understand what strategies work best at different stages of the sales cycle and how to tailor their approach to meet the needs of each deal.,https://www.gong.io/,Commercial,Sales Enablement,"[""AI"", ""Sales Cycle"", ""Communication Analysis"", ""Sales Strategy""]",2025-04-25 16:16:25.655192,2025-04-25 16:16:25.655192
45,Chorus.ai,"Chorus.ai is an AI-driven platform that records, transcribes, and analyzes sales calls to provide actionable insights. It helps in mentoring junior sales staff by identifying successful sales tactics and areas for improvement, offering personalized feedback based on real sales interactions.",https://www.chorus.ai,Commercial,Sales Enablement,"[""AI"", ""Sales Training"", ""Mentorship"", ""Call Analysis""]",2025-04-25 16:16:25.659624,2025-04-25 16:16:25.659624
46,Jiminny,"Jiminny is a platform designed for coaching and developing sales teams. It uses AI to capture and analyze sales conversations, providing feedback and training modules tailored to individual needs, thereby enhancing the mentorship process for junior sales staff.",https://www.jiminny.com,Commercial,Sales Training,"[""AI"", ""Sales Development"", ""Training Platform"", ""Conversation Intelligence""]",2025-04-25 16:16:25.664388,2025-04-25 16:16:25.664388
47,MindTickle,"MindTickle offers a sales readiness platform that uses AI to provide data-driven insights for sales training and coaching. It helps in creating personalized learning paths for junior sales staff, ensuring they are trained based on proven best practices and individual performance metrics.",https://www.mindtickle.com,Commercial,Sales Enablement,"[""Sales Readiness"", ""AI Training"", ""Personalized Learning"", ""Sales Performance""]",2025-04-25 16:16:25.667526,2025-04-25 16:16:25.667526
48,UiPath,"UiPath is a Robotic Process Automation (RPA) tool that helps businesses automate repetitive tasks. It can be used to improve operational processes by enabling employees to design automation workflows, which can lead to increased efficiency and innovation in daily operations.",https://www.uipath.com/,Commercial,Robotic Process Automation,"[""RPA"", ""automation"", ""operational efficiency"", ""innovation""]",2025-04-25 16:16:25.680115,2025-04-25 16:16:25.680115
49,Pega Platform,"Pega Platform is a digital process automation tool that helps organizations streamline operations and improve customer engagement. It provides AI-powered decisioning capabilities that allow employees to optimize and innovate operational processes, enhancing productivity and customer satisfaction.",https://www.pega.com/,Commercial,Business Process Management,"[""process automation"", ""AI decisioning"", ""customer engagement"", ""innovation""]",2025-04-25 16:16:25.683014,2025-04-25 16:16:25.683014
50,Kissflow,"Kissflow is a cloud-based workflow and process automation platform that enables organizations to manage, automate, and optimize their business processes. It empowers employees to contribute to operational improvements by providing tools to create and modify workflows, thereby fostering a culture of continuous innovation.",https://kissflow.com/,Freemium,Workflow Automation,"[""workflow automation"", ""process management"", ""continuous improvement"", ""innovation""]",2025-04-25 16:16:25.685513,2025-04-25 16:16:25.685513
