tool_id,tool_name,description,website_url,license_type,primary_category,tags,created_at,updated_at
51,IBM Watson,"IBM Watson offers AI and machine learning solutions that can be applied across various business operations to enhance decision-making and process efficiencies. It supports operational improvement by providing insights and predictive analytics, enabling employees to innovate and improve their work processes.",https://www.ibm.com/watson,Commercial,AI Platform,"[""AI"", ""machine learning"", ""predictive analytics"", ""operational improvement""]",2025-04-25 16:16:25.687903,2025-04-25 16:16:25.687903
52,Monday.com,"Monday.com is a work operating system that allows teams to create workflow apps in minutes to run their processes, projects, and everyday work. Tools within Monday.com enable teams to continuously improve operational processes and foster innovation through better collaboration and workflow customization.",https://monday.com,Freemium,Project Management,"[""project management"", ""workflow customization"", ""collaboration"", ""innovation""]",2025-04-25 16:16:25.690311,2025-04-25 16:16:25.690311
53,Affinity,Affinity uses AI to analyze communication data and automatically capture relationship insights. It helps users manage executive relationships by providing insights into interaction histories and suggesting the best paths to strengthen these connections.,https://www.affinity.co/,Commercial,CRM,"[""relationship management"", ""executive engagement"", ""AI CRM""]",2025-04-25 16:16:25.692734,2025-04-25 16:16:25.692734
54,Nudge.ai,Nudge.ai is an AI-powered platform that provides relationship intelligence. It helps businesses understand and leverage their relationships with executives by offering actionable insights based on communication patterns and network strength.,https://nudge.ai/,Commercial,Relationship Intelligence,"[""AI networking"", ""executive relationships"", ""business intelligence""]",2025-04-25 16:16:25.69548,2025-04-25 16:16:25.69548
55,BoardEx,"BoardEx is an advanced analytics platform that focuses on relationship mapping. It helps organizations identify and leverage connections with key executives, providing detailed profiles and relationship strength indicators.",https://www.boardex.com/,Commercial,Analytics,"[""executive relationships"", ""relationship mapping"", ""strategic planning""]",2025-04-25 16:16:25.697937,2025-04-25 16:16:25.697937
56,PathFactory,"PathFactory employs AI to analyze customer engagement with content across various channels, helping businesses understand customer interests and pain points. This data allows companies to develop a deep understanding of the customer's business needs and tailor their marketing and sales strategies accordingly.",https://www.pathfactory.com,Commercial,Content Marketing,"[""Content Engagement"", ""AI"", ""Marketing Automation"", ""Customer Understanding""]",2025-04-25 16:16:25.70289,2025-04-25 16:16:25.70289
57,Node,"Node uses artificial intelligence to discover new business opportunities by analyzing relationships between people, companies, products, and markets. This tool helps in understanding the customer's business context, strategic goals, and industry dynamics, enabling personalized solution offerings.",https://www.node.io,Commercial,AI Analytics,"[""AI"", ""Business Development"", ""Market Intelligence"", ""Personalization""]",2025-04-25 16:16:25.705362,2025-04-25 16:16:25.705362
58,Zilliant IQ,Zilliant IQ is an AI-driven pricing and sales solution that optimizes pricing strategies and identifies sales opportunities. It supports strategic account leadership by enabling personalized account planning and execution strategies based on comprehensive data analysis.,https://www.zilliant.com/solutions/zilliant-iq,Commercial,Pricing and Sales Optimization,"[""AI"", ""pricing strategy"", ""sales optimization"", ""account management"", ""data analysis""]",2025-04-25 16:16:25.712294,2025-04-25 16:16:25.712294
59,Hubdoc,"Hubdoc is a financial document automation tool that automatically collects bank statements, bills, and receipts from various sources, using AI to extract key data and organize documents efficiently. It integrates with accounting software like Xero to streamline financial document management.",https://www.hubdoc.com,Commercial,Financial Document Management,"[""document automation"", ""financial management"", ""data extraction""]",2025-04-25 16:16:25.730157,2025-04-25 16:16:25.730157
60,AutoEntry,"AutoEntry is an AI-powered tool that automates data entry by capturing, analyzing, and organizing financial documents. It supports a wide range of document types including bills, invoices, and receipts, making it ideal for preparing for financial meetings by ensuring all documents are accurately organized and accessible.",https://www.autoentry.com,Commercial,Data Entry Automation,"[""data capture"", ""financial documents"", ""automation""]",2025-04-25 16:16:25.73253,2025-04-25 16:16:25.73253
61,Receipt Bank,"Now known as Dext Prepare, this tool extracts information from financial documents using machine learning. It helps businesses collect, process, and store receipts, invoices, and other financial documents efficiently, ensuring that all necessary paperwork is prepared and organized before any financial meeting.",https://dext.com,Commercial,Financial Document Management,"[""receipt management"", ""invoice processing"", ""document storage""]",2025-04-25 16:16:25.734944,2025-04-25 16:16:25.734944
62,Medallia,"Medallia captures customer feedback across web, mobile, and social channels, analyzes it in real-time, and delivers actionable insights to improve customer satisfaction. It uses advanced AI algorithms to understand customer sentiments and trends.",https://www.medallia.com,Commercial,Customer Experience Management,"[""customer feedback"", ""AI analytics"", ""real-time"", ""customer satisfaction""]",2025-04-25 16:16:25.737563,2025-04-25 16:16:25.737563
63,Qualtrics CustomerXM,"Qualtrics CustomerXM uses machine learning and predictive analytics to monitor and analyze customer interactions across multiple channels. It provides insights into customer sentiment and behavior, helping businesses enhance their customer satisfaction strategies.",https://www.qualtrics.com/customer-experience/,Commercial,Customer Experience Management,"[""customer experience"", ""predictive analytics"", ""machine learning"", ""customer insights""]",2025-04-25 16:16:25.739979,2025-04-25 16:16:25.739979
64,Clarabridge,"Clarabridge offers a comprehensive solution for analyzing customer feedback from various sources including social media, emails, and call center communications. It uses natural language processing (NLP) to extract meaningful insights from unstructured data, aiding in customer satisfaction improvement.",https://www.clarabridge.com,Commercial,Customer Feedback Analysis,"[""NLP"", ""customer feedback"", ""data analysis"", ""customer satisfaction""]",2025-04-25 16:16:25.74226,2025-04-25 16:16:25.74226
65,Zendesk,"Zendesk provides a suite of tools including support, chat, and call center solutions that integrate AI to enhance customer service interactions. Its AI capabilities help in automating responses and analyzing customer satisfaction trends to improve service quality.",https://www.zendesk.com,Commercial,Customer Support,"[""customer support"", ""AI automation"", ""service quality"", ""customer satisfaction""]",2025-04-25 16:16:25.744989,2025-04-25 16:16:25.744989
66,HubSpot CRM,"HubSpot CRM integrates AI to streamline customer relationship management processes. It features tools for email scheduling, lead scoring, and chatbots that provide real-time assistance to customers, enhancing engagement and satisfaction.",https://www.hubspot.com/products/crm,Freemium,CRM AI,"[""CRM"", ""lead scoring"", ""chatbots"", ""customer support""]",2025-04-25 16:16:25.762418,2025-04-25 16:16:25.762418
67,Freshsales,"Freshsales by Freshworks uses AI to offer predictive contact scoring, which prioritizes leads based on their likelihood of conversion. It also features AI-driven insights for sales forecasting and customer engagement analysis.",https://www.freshworks.com/crm/sales/,Commercial,CRM AI,"[""CRM"", ""lead scoring"", ""sales forecasting"", ""customer insights""]",2025-04-25 16:16:25.765206,2025-04-25 16:16:25.765206
68,Pipedrive,Pipedrive incorporates AI to automate repetitive tasks and provide sales forecasting. Its AI capabilities help in managing leads and deals by predicting future sales outcomes and suggesting actions to improve sales processes.,https://www.pipedrive.com,Commercial,CRM AI,"[""CRM"", ""sales automation"", ""forecasting"", ""lead management""]",2025-04-25 16:16:25.767651,2025-04-25 16:16:25.767651
69,Ada,"Ada is an AI-powered platform that automates customer service interactions and provides technical consultation and support. It uses natural language processing to understand and respond to user inquiries, making it suitable for providing expert advice in technical fields.",https://www.ada.cx/,Commercial,Customer Support AI,"[""AI Chatbot"", ""Customer Service"", ""NLP"", ""Technical Support""]",2025-04-25 16:16:25.770201,2025-04-25 16:16:25.770201
70,Watson Assistant,"IBM's Watson Assistant uses AI to help businesses build conversational interfaces into any application, device, or channel. It can be used for technical consultation by understanding complex technical queries and providing precise answers or guidance using its advanced natural language processing capabilities.",https://www.ibm.com/cloud/watson-assistant/,Commercial,AI Chatbot,"[""NLP"", ""Chatbot"", ""Technical Support"", ""AI Assistant""]",2025-04-25 16:16:25.77268,2025-04-25 16:16:25.77268
71,Zendesk Answer Bot,"Zendesk Answer Bot is designed to improve customer support by using machine learning to automatically respond to customer inquiries. It can be integrated into technical support scenarios to provide immediate, automated responses to technical questions, thereby enhancing the efficiency of support teams.",https://www.zendesk.com/service/answer-bot/,Commercial,Customer Support AI,"[""Customer Support"", ""AI Bot"", ""Machine Learning"", ""Technical Consultation""]",2025-04-25 16:16:25.775013,2025-04-25 16:16:25.775013
72,Rasa,Rasa is an open-source machine learning framework for automated text and voice-based conversations. Developers can use Rasa to create sophisticated AI assistants capable of providing technical consultation and support by understanding and processing user queries in a conversational context.,https://rasa.com/,Open Source,AI Framework,"[""Open Source"", ""Chatbot"", ""Machine Learning"", ""Technical Support""]",2025-04-25 16:16:25.77747,2025-04-25 16:16:25.77747
73,Crunchbase Pro,"Crunchbase Pro uses advanced search capabilities and custom list building to help businesses identify key market players and emerging competitors. It provides insights into industry trends, funding history, and key company data to strategize market entry and customer acquisition.",https://www.crunchbase.com/products/crunchbase-pro,Commercial,Market Research,"[""market analysis"", ""competitive insights"", ""investment tracking"", ""business intelligence""]",2025-04-25 16:16:25.792586,2025-04-25 16:16:25.792586
74,CB Insights,"CB Insights leverages machine learning to analyze millions of data points on venture capital, startups, patents, partnerships, and news mentions to help companies discover and understand the competitive landscape in new markets. This tool is essential for developing informed market expansion strategies.",https://www.cbinsights.com/,Commercial,Market Intelligence,"[""AI analytics"", ""market trends"", ""competitive analysis"", ""strategic planning""]",2025-04-25 16:16:25.795724,2025-04-25 16:16:25.795724
75,Market Explorer by SimilarWeb,"Market Explorer provides digital market intelligence by analyzing web traffic and engagement metrics. This tool helps businesses understand online market sizes, customer behaviors, and benchmark against competitors, which is vital for digital market expansion strategies.",https://www.similarweb.com/corp/solutions/market-research/,Commercial,Digital Market Intelligence,"[""market research"", ""traffic analysis"", ""competitive benchmarking"", ""digital strategy""]",2025-04-25 16:16:25.800512,2025-04-25 16:16:25.800512
76,Microsoft Dynamics 365 AI,"This tool leverages AI to provide insights into business processes and customer needs, facilitating effective solution recommendations based on deep learning of company products. It helps in tailoring solutions to customer requirements and streamlining the implementation process.",https://dynamics.microsoft.com/en-us/ai/,Commercial,Business Intelligence,"[""business intelligence"", ""deep learning"", ""solution advising""]",2025-04-25 16:16:25.81573,2025-04-25 16:16:25.81573
77,CrunchMetrics,"CrunchMetrics uses advanced AI and machine learning technologies to analyze business data and provide insights into potential ROI from various strategies and investments. It helps businesses communicate these insights effectively to stakeholders, emphasizing the financial and strategic benefits of products or services.",https://www.crunchmetrics.ai,Commercial,Business Intelligence,"[""AI"", ""ROI Analysis"", ""Machine Learning"", ""Data Analytics""]",2025-04-25 16:16:25.824587,2025-04-25 16:16:25.824587
78,Proof BusinessGPS,"Proof BusinessGPS employs AI to forecast and measure the financial outcomes of different business strategies, including marketing and operational investments. It provides a clear visualization of ROI and strategic benefits, which can be crucial for presentations to high-value clients.",https://www.proofanalytics.ai,Commercial,Analytics,"[""ROI Forecasting"", ""Financial Modeling"", ""Strategic Planning"", ""AI""]",2025-04-25 16:16:25.826975,2025-04-25 16:16:25.826975
79,ClearStory Data,"ClearStory Data's platform leverages AI and machine learning to analyze and harmonize large amounts of data from disparate sources, providing insights that help businesses understand the ROI of their initiatives. This tool is particularly useful for communicating complex financial benefits to clients in a digestible format.",http://www.clearstorydata.com,Commercial,Data Integration,"[""Data Analysis"", ""Machine Learning"", ""ROI Insights"", ""AI""]",2025-04-25 16:16:25.829702,2025-04-25 16:16:25.829702
80,LinkedIn Sales Navigator,"LinkedIn Sales Navigator is an advanced sales tool that aids in the process of finding the right prospects to build trusted relationships. It leverages AI to provide recommendations based on combined user data and network interactions, which can be crucial for collaborative business development.",https://business.linkedin.com/sales-solutions/sales-navigator,Commercial,Sales Intelligence,"[""sales"", ""networking"", ""AI"", ""business development"", ""lead generation""]",2025-04-25 16:16:25.832354,2025-04-25 16:16:25.832354
82,Salesloft,"Salesloft offers a powerful sales engagement platform equipped with AI capabilities to streamline the sales process. It features tools for email tracking, automated dialing, and personalized outreach, all designed to increase the efficiency and effectiveness of sales teams.",https://www.salesloft.com,Commercial,Sales Engagement,"[""Sales Automation"", ""AI"", ""Email Tracking"", ""Automated Dialing""]",2025-04-25 16:16:25.849859,2025-04-25 16:16:25.849859
83,Einstein AI by Salesforce,"Einstein AI integrates with Salesforce CRM to provide AI-driven insights, predictions, and recommendations. It helps in personalizing customer interactions based on their history and social data, enhancing relationship management.",https://www.salesforce.com/products/einstein/overview/,Commercial,CRM,"[""AI CRM"", ""customer engagement"", ""predictive analytics"", ""relationship management""]",2025-04-25 16:16:25.872895,2025-04-25 16:16:25.872895
84,Bizzabo,Bizzabo is an event management software that leverages AI to help businesses plan and optimize their events. It uses AI algorithms to analyze past event data and attendee behavior to recommend the most relevant events and meetings that could yield high ROI based on strategic importance.,https://www.bizzabo.com,Commercial,Event Management,"[""AI"", ""Event Optimization"", ""Networking"", ""ROI""]",2025-04-25 16:16:25.877251,2025-04-25 16:16:25.877251
85,Eventbrite,Eventbrite uses AI to provide insights and recommendations for event organizers to optimize event planning and execution. It analyzes historical data on event performance and attendee engagement to suggest the best types of events and networking opportunities that align with business goals.,https://www.eventbrite.com,Freemium,Event Management,"[""Event Planning"", ""AI"", ""Data Analysis"", ""Networking""]",2025-04-25 16:16:25.879861,2025-04-25 16:16:25.879861
86,Whova,"Whova offers an AI-powered event management platform that assists organizers in selecting and optimizing events based on detailed analytics of past events, attendee preferences, and potential business impacts. Its AI engine recommends networking events that are most likely to improve engagement and ROI.",https://www.whova.com,Commercial,Event Management,"[""AI"", ""Event Analytics"", ""Networking Optimization"", ""Strategic Planning""]",2025-04-25 16:16:25.882437,2025-04-25 16:16:25.882437
87,Guru,"Guru is a knowledge management tool that uses AI to organize and deliver relevant product information to team members in real-time. It integrates with various communication platforms to ensure that all team members have access to the latest product updates and information, enhancing client interactions.",https://www.getguru.com,Freemium,Knowledge Management,"[""AI"", ""Knowledge Management"", ""Real-time"", ""Product Information""]",2025-04-25 16:16:25.901994,2025-04-25 16:16:25.901994
88,Bloomfire,"Bloomfire is a platform that centralizes company knowledge, including detailed product information, and uses AI to make this data easily searchable and accessible. It helps ensure that all team members are on the same page regarding product features and updates, which is crucial for client interactions.",https://www.bloomfire.com,Commercial,Knowledge Management,"[""Searchable Knowledge Base"", ""AI"", ""Product Knowledge"", ""Client Interaction""]",2025-04-25 16:16:25.904419,2025-04-25 16:16:25.904419
89,Celonis,"Celonis is a process mining tool that uses AI and machine learning to analyze business processes and identify inefficiencies. It provides insights and recommendations for process optimization, helping organizations to improve their operational efficiency.",https://www.celonis.com/,Commercial,Process Mining,"[""process mining"", ""AI"", ""machine learning"", ""process optimization""]",2025-04-25 16:16:25.91192,2025-04-25 16:16:25.91192
90,Pega,"Pega is a business process management (BPM) tool that uses AI to automate and optimize business processes. It provides a platform for building applications that automate tasks, streamline operations, and improve decision making, thereby enhancing overall process efficiency.",https://www.pega.com/,Commercial,Business Process Management,"[""BPM"", ""AI"", ""process automation"", ""decision automation""]",2025-04-25 16:16:25.91448,2025-04-25 16:16:25.91448
91,Blue Prism,"Blue Prism is an RPA tool that enables businesses to automate complex and rule-based processes. It uses AI to manage and optimize workflows, helping organizations to achieve greater efficiency and accuracy in their operations.",https://www.blueprism.com/,Commercial,Robotic Process Automation,"[""RPA"", ""AI"", ""workflow management"", ""process optimization""]",2025-04-25 16:16:25.917084,2025-04-25 16:16:25.917084
92,OpenAI GPT-4,"GPT-4 is an advanced language model developed by OpenAI that can generate human-like text based on the input it receives. It can adapt to new topics and scenarios, making it useful for brainstorming and generating innovative ideas in various domains. It can also be fine-tuned to specific organizational needs, supporting new process implementations by providing insights and automated content generation.",https://www.openai.com/gpt-4,Commercial,AI Language Model,"[""AI"", ""language model"", ""innovation"", ""adaptability"", ""ideation""]",2025-04-25 16:16:25.91954,2025-04-25 16:16:25.91954
93,Microsoft Azure Machine Learning,"Azure Machine Learning is a cloud-based platform for building, training, and deploying machine learning models. It supports adaptability by allowing users to quickly scale and modify models based on new data and changing business requirements. The platform fosters innovation through its extensive toolset that supports various machine learning techniques and integration with other Azure services.",https://azure.microsoft.com/en-us/services/machine-learning/,Commercial,Machine Learning Platform,"[""machine learning"", ""cloud"", ""AI"", ""adaptability"", ""innovation""]",2025-04-25 16:16:25.924007,2025-04-25 16:16:25.924007
94,Google Cloud AutoML,"Google Cloud AutoML enables developers with limited machine learning expertise to train high-quality models specific to their business needs. It adapts to new data inputs and changes in business processes, facilitating the testing and implementation of innovative approaches. AutoML supports various data types and machine learning tasks, enhancing its adaptability and utility in diverse scenarios.",https://cloud.google.com/automl,Commercial,Automated Machine Learning,"[""automated ML"", ""cloud"", ""AI"", ""adaptability"", ""innovation""]",2025-04-25 16:16:25.92664,2025-04-25 16:16:25.92664
95,Outreach Kaia,"Outreach Kaia is an AI-powered knowledge assistant that captures and shares real-time insights during sales calls. It aids in consultative selling by analyzing conversations to identify customer needs and decision-making criteria, including budget and authority, helping sales reps tailor their discussions and offerings effectively.",https://www.outreach.io/product/kaia,Commercial,Sales Engagement,"[""AI"", ""Sales Calls"", ""Real-time Insights"", ""Consultative Selling"", ""BANT""]",2025-04-25 16:16:25.933767,2025-04-25 16:16:25.933767
96,Lessonly by Seismic,"Lessonly is a training and coaching platform powered by AI that helps sales teams practice, learn, and improve their sales skills through scenario-based learning and real-time feedback.",https://www.lessonly.com,Commercial,Corporate Training,"[""training platform"", ""AI"", ""sales development"", ""real-time feedback""]",2025-04-25 16:16:25.948651,2025-04-25 16:16:25.948651
97,Intercom,"Intercom provides a customer communication platform with a strong focus on automation and AI. It uses chatbots and personalized messaging services to educate and engage customers about company services, thereby supporting sales and customer service efforts.",https://www.intercom.com,Commercial,Customer Communication,"[""customer communication"", ""chatbots"", ""personalized messaging"", ""customer engagement""]",2025-04-25 16:16:25.976172,2025-04-25 16:16:25.976172
99,Clara,"Clara is a virtual employee that schedules your meetings, powered by machine learning. It communicates with meeting participants via email to find suitable times and manages the entire scheduling process.",https://claralabs.com,Commercial,Productivity,"[""virtual scheduling assistant"", ""email coordination"", ""AI assistant""]",2025-04-25 16:16:25.981555,2025-04-25 16:16:25.981555
100,Zoom.ai,"Zoom.ai is an automated assistant that helps schedule meetings, with deep integration into multiple calendar platforms. It uses AI to suggest optimal meeting times and can automatically send invites to participants.",https://www.zoom.ai,Commercial,Communication,"[""automated meeting scheduler"", ""AI-powered"", ""calendar integration""]",2025-04-25 16:16:25.984025,2025-04-25 16:16:25.984025
101,Cronofy,Cronofy's Scheduler is a powerful tool that connects to all major calendar services to help find the best times for meetings. It uses AI to analyze availability and preferences to optimize meeting scheduling.,https://www.cronofy.com,Commercial,Productivity,"[""calendar API"", ""meeting optimization"", ""schedule management""]",2025-04-25 16:16:25.986392,2025-04-25 16:16:25.986392
102,Pipedrive LeadBooster,Pipedrive's LeadBooster is an AI-powered chatbot that pre-qualifies leads directly through website interactions. It asks predefined qualification questions and uses the responses to score and route leads accordingly within the Pipedrive CRM system.,https://www.pipedrive.com/en/features/leadbooster,Commercial,CRM and Sales Automation,"[""chatbot"", ""lead management"", ""CRM"", ""AI""]",2025-04-25 16:16:25.995157,2025-04-25 16:16:25.995157
103,Freshsales Freddy AI,Freddy AI by Freshsales uses artificial intelligence to analyze past lead and sales data to score leads and predict their chances of conversion. It provides insights and recommendations for best next actions to take with each lead.,https://www.freshworks.com/freshsales-crm/,Commercial,CRM and Sales Automation,"[""AI"", ""CRM"", ""lead scoring"", ""sales predictions""]",2025-04-25 16:16:25.997746,2025-04-25 16:16:25.997746
104,Einstein Analytics,Einstein Analytics by Salesforce uses AI to enhance sales performance tracking by analyzing sales data and providing predictive insights and prescriptive recommendations. It helps sales teams understand performance trends and make data-driven decisions.,https://www.salesforce.com/products/einstein-analytics/overview/,Commercial,Business Intelligence,"[""AI"", ""Sales Performance"", ""Analytics"", ""Predictive Insights""]",2025-04-25 16:16:26.000228,2025-04-25 16:16:26.000228
